id,original_text,lang,retweet_count,original_author,sentiment_class
1246648937295020000,May God continue to bless our mothers and use them to enrich our homes, sustain our society and heal our world. RT #DominicanMedia #Mothers #Mothersday #Happymothers #Mom #family #fam #mom #love #RT #everything #myworld #mother #related #photooftheday #life #happy #familytime pic.twitter.com/Xjr8ImFFXZ,0,0,personalfitnes3,0
1246462609878130000,She was mine first though @RodneySA96 Happy Mother's Day Momma. @sareneanita And for those wondering, yes, it is Mother's Day somewhere #mothersdayuk #MothersDay https:// twitter.com/RodneySA96/sta tus/1241853800152993792 …,56,en,0,0
1245262133702650000,Oh & cake with copious amounts of tea! Happy #MothersDay & thank you @BrewAndBakeHQ for helping make this possible today #afternoontea #Cheltenham pic.twitter.com/ljGnhWrwjn,0,0,alfaroos_store,1
1246146732142010000,Good evening Jan, I hope you haven't had as much wine as me! Unfortunately my daughter's & grandson couldn't come over today so I've had to drink it all myself! Happy Mothers day,0,1,teetime4autism,1
1246482461179160000,Happy Mother's Day #Mothers are special part of a family, and to a larger extent, society. While men are more concerned about making money and providing for the family, mothers spend large chunk of their lives birthing and rearing child.... https://www. facebook.com/36426361058377 0/posts/1124811394528984/ … #MothersDay pic.twitter.com/g4bhOdNKLV,0,0,KidyPlace,0
1246331303336670000,Day 5 in self-iso. Over 1/3 of the way through now... Happy Mothers Day ! It was great we were able to spend EVERY SINGLE MINUTE OF THE DAY with natwoodgate today and, naturally, she was treated like the King of… https://www. instagram.com/p/B-DSoBXBNyC/ ?igshid=7nqore0pc751 …,0,2,MAJIC_EYES_QNLY,0
1245394493572100000,Happy Mothers Day to all the Mums involved at Roseacre Raiders. We couldn't do it without you all. Stay safe . Up the Raiders! #HappyMothersDay pic.twitter.com/u7pogWTsBT,0,0,andreaanderegg,1
1246699645193030000,Happy Mothers Day 2020 Quotes Images, And Memes https:// bestnewyearwishes.info/happy-mothers- day-2020-quotes-images-and-memes/ … pic.twitter.com/oaqJYEHPPd,0,0,MoM_Mastering,1
1244378485751260000,To all mums out there, Happy Mother's Day! We are still open for takeaway for collection only or you can order through @justeatuk or @deliveroo if you don't want to go outside of your house. DON'T LET THE COVID-19 RUIN YOUR SPECIAL DAY! Stay safe! #mothersday #malaysianfoodleeds pic.twitter.com/VFP9WUwHoO,0,0,LToddWood,0
1246653288029670000,Happy mothers day to us and all the other mothers round the world,May Almighty God protect and guide us and our families to live to tell of this story of covid19 in Jesus Christ Mighty Name Amen pic.twitter.com/GXmSKPLblg,57,0,0,0
1245854177072260000,On friday, I was classed as a high risk group for Covid 19 by WHO, today the UK government has taken people like me off the NHS list. I am still at risk but can no longer get government help in the UK. Thanks Boris, Happy Mothers Day .,0,0,RichardLTackett,-1
1244431643378700000,Happy Mother’s Day to all those wonderful mothers out there that can’t be with their families #StayAtHome #MothersDay #love #rabbit #babies #daffodils #spring #illustration #Pencildrawing pic.twitter.com/EomfB8CUTZ,0,0,LToddWood,0
1244233607151060000,Happy Mothers Day to these 3 amazing mothers in my life. Each day they show me how strong, loving and how incredible they are. To mum who would do anything for us all, to meadhbh Anluan is… https://www. instagram.com/p/B-CVB5MB0Kjb u1A4bxuQZRGetUukBhkgZl2d800/?igshid=f7fp8p84m36r …,0,0,officeoffspring,0
1244637653879960000,so we can all see our family's no one is taken this seriously when people are risking their lifes to save them let's kill this virus and stay home. Also happy mothers day to all you NHS staff that can't see their family's,0,0,TrendingNowGift,1
1246524058134620000,“Mother's Day Greeting Online“ and a bit of a chat too catch up on the local news. Denis Brennan, from Tralee, Co Kerry, says happy #MothersDay to his wife, of over 60 yrs, Maisie via his computer. Photo Domnick Walsh for Eye Focus #CapturingHistory #StayAtHome pic.twitter.com/mm7buy7n19,0,0,MrThestral101,-1
1245252655812840000,Happy Mothers Day to you and all the Wonderful Mothers and Mothers to be in the World. We and appreciate you all . https://www. instagram.com/p/B-CliqUpcXU/ ?igshid=108p0bpw8o61v …,0,0,MoM_Mastering,0
1245888199358120000,Happy Mothers Day and stay safe Dear Customers ! #Balloon Expression . #mothersday #balloon #staysafe @Cheshunt https://www. instagram.com/p/B-C5j8cgmy0/ ?igshid=lkp140woznsu …,0,0,LToddWood,0
1245879494038170000,MOTHERS' DAY CELEBRATION A mother is a person who can take the place of all others, but whose place no one else can take. Kudos to our mothers. HAPPY MOTHERS' DAY to all responsible mothers and wishing many blessed returns. Everlasting Joy shall be your portion IJMN, Amen. pic.twitter.com/ci6sXZqduG,0,0,TheNewsIntern1,0
1246093712641260000,* MOTHERS DAY * . Happy Mother’s Day to all of our special mums . We are sorry we can’t spoil you today . We are sure we will spoil you soon . Did you have a nice Mother’s Day? . #grimscotemanor #quote … https://www. instagram.com/p/B-DCbuzBWLI/ ?igshid=k5dweuc5ap24 …,0,1,Covergirlbeads,0
1244298625561180000,Happy Mothers' Day ! We love and celebrate every amazing mother out there. Stay beautiful, stay popping! #PopCelebrates #HappyMothersDay2020 pic.twitter.com/A4iTR5W3TA,0,0,Glassflippers,0
1246371229373780000,good night Bumble Barney and Edward. We are not sure if it is Mothers day where you are but please wish mummy a Happy Mothers day if it is with lots of hugs. Tucking you all in with hugs and cuddles. We love you all very much.,58,en,0,0
1244526328579310000,Happy mother's day to the two most important women in my life #mothersday #happymothersday#mummy #motherinlaw https://www. instagram.com/p/B-CYNzmBFix/ ?igshid=1n2c25a37xy1w …,0,0,MoM_Mastering,0
1244589519296280000,Thank you for laughing with us in the best of times and sticking with us through the worst of times! What would we do without you? We love you! Happy Mother's Day! #KingFisherAfrica #MothersDay #Sunday #Love pic.twitter.com/eDI5sSYR22,0,0,peachymo1,-1
1245068053982970000,Raising a glass to my brave mum today who I cannot see for the moment happy mothers day to an amazing mum and grandma x x pic.twitter.com/ufdBzMlr4K,0,0,BirthInjuryCtr,0
1245879729716190000,Happy Mammy’s Day, I know it’s tough times not seeing eachother today, but better times are coming. #socialdistancing #mothersday pic.twitter.com/rU45QISF0c,0,0,edwardistheman,1
1246076584966190000,Happy Mothers’ Day all! I am lucky enough to have a Mamma who is my inspiration, my everyday hero and my best friend Here are two books I read last year about very different mother-daughter relationships. Give one a try! #reading #bookworm #booklover #mothersday #books #read pic.twitter.com/aopip2yGpf,0,0,DougInBiddeford,1
1246576195459850000,That is not what you did. You made it very clear that any man, maybe a widower, that has taken on the mother role to their child, does not deserve to be wished a happy mothers day .,0,0,SchoenthalLiza,1
1246105263884640000,Mothers’ Day a different way. We made a Happy Mothers’ Day sign to put in our window, plus a rainbow picture (something our whole village is doing to bring joy to us all when we go for a suitably-distanced walk). We… https://www. instagram.com/p/B-DDDm7nSdJ/ ?igshid=1pqfl49o8diu6 …,0,0,WondermomWannab,-1
1246138908661950000,Been inactive last few days puppys, packing to move and this dam virus. Were all doing well, eyes not open yet but super cute. Happy mothers day all you mothers out there #MothersDay pic.twitter.com/fesb7znmq2,0,0,LiveGoodProduct,0
1244846617267710000,Happy Mothers Day ! Monty was surprised by Daddys chose of card but agreed with it without question..... Sending love to all the strong women in my life, mothers of cats, dogs, humans... #weirdosforlife #mothersday … https://www. instagram.com/p/B-CeEBXlpeo/ ?igshid=uqn1ru04q8jw …,0,0,grouptherapy33,0
1245068578925110000,Happy Mothers day to the most loving,giving woman.She shared her heart with 72 foster children. Here she is with my sister and me (pink dress) I'm staying away from my mum right now,trying to keep her as safe as possible. pic.twitter.com/qARQZJ3zhV,0,0,AndreasRiandy,1
1246463748254110000,Happy 1st Mother's Day @deirdrekennedyx. Phones are social too. #socialdistancing #exploring #thegreatoutdoors #inchloop #tipperary #familystrolls #mothersday https:// ift.tt/3dl6yUT Happy 1st Mother's Day @deirdrekennedyx. Phones are social too. #socialdistanci … pic.twitter.com/NeDOh59aig,0,0,LToddWood,0
1244370016524540000,Happy Mother’s Day to all the special mothers out there! And of course, to our lovely team at Markree Home Farms. #MothersDay #Mother #MarkreeHomeFarms #Sligo pic.twitter.com/yU7WakOuCh,0,0,STOLEYBANDZO,-1
1244618379828380000,Happy mothers day too all the great mums .especially the soccer mums who get out every weekend in cold winter months too let the kids enjoy sport of any kind .,0,4,StarringUJewel,1
1245440148680180000,Wishing all you lovely mums out there a very Happy Mother’s Day Strange one this year! Share the love with words, small gestures, send virtual or text love & hugs to those close to you, pick up the phone! #MothersDay #motheringsunday #mothersday2020 #StayAtHome #ComeTogether pic.twitter.com/LQbow6SaS8,0,0,jewelrymandave,-1
1245193466348530000,happy mothersday to @KirstyL23978867 for being a awesome mum and the perfect nerd partner! She would say I"" love you"". I normally reply with ""I know"" pic.twitter.com/A95T9LWIK0,0,0,DatFrenchKid,0
1246547759596960000,@thismorning Happy mothers day to our mum Maggie Lee whos been in her new home at Hillbeck, BearstedHaven't seen her for 3 weeks due lock down . Love ya from all us pic.twitter.com/GFRnIvyda7,0,0,fashinistajonz,-1
1245518763451190000,Everyone at Alien vs. Predator Galaxy would like to wish all our UK members a happy Mother's Day! #Alien #Aliens #Xenomorph #XenomorphXX121 #QueenAlien #MothersDay #mothersday2020 #MotheringSunday pic.twitter.com/cjDiJkBbxW,0,0,jugsjeni,0
1246151634083770000,Happy mothers Day Mummy Reposted from bnbladies I’ll like to warmly celebrate every MOTHER out there on this Special Mother’s Day Celebration. Happy Mother’s Day to You! I Love and Celebrate… https://www. instagram.com/p/B-DIcmqJXNy/ ?igshid=ig0mjpljnk73 …,0,0,LToddWood,-1
1244981137367330000,Happy #MothersDay to the incredible women in these photos, we wouldn't be here with out you. We know this day can be tough for some, sending all of our love and thoughts your way pic.twitter.com/kr1Mk5QOYk,59,en,0,0
1246276501512890000,Happy Mothers Day to you all whether you are the mummy, step mum, soon to be mum, mum to fur babies or the dad who is also the mum. You rock! With times such as they are we are now becoming teachers, gym instructors and play dates. It may not be the year… https:// ift.tt/3doHTP2 pic.twitter.com/CWqci58ak2,0,1,SingingJaya,0
1244532410680820000,Happy birthday and mothers day to my maw thanks for putting up with us both, especially that asbo Harper Haha Hope you have the best day stuck in with us Loveee ya xx https://www. instagram.com/p/B-CYSdPDW3S/ ?igshid=15cw54n2d0ywl …,0,0,MoM_Mastering,-1
1244519229484870000,To the ones we have, the ones we've lost and the ones we will become... Happy mothers day . https:// twitter.com/TheVbankng/sta tus/1241703867378696195 …,0,1,FixedZikky,0
1244756298891170000,Happy Mother's Day to all our mothers and grandmother's. You are priceless and Covenant Elderly Care Foundation appreciates each and everyone of you. #MothersDay #eldercare #cecfoundation #seniorcitizens #internationalwomensday #CECFValues #Grateful #woman,60,en,1,0
1244373384043160000,""No language can express the power and beauty and heroism of a mothers love.""- Happy Mothers Day from all the team at Romantic Castles of Ireland. #MothersDay #Women #CastleHotels #Mother #Bride #MotherOfTheBride #Wedding pic.twitter.com/W1s0sIjYmp,0,0,SHOPPINGDIVA1,-1
1244994071732650000,Excuse the wild hair. That's what self-isolation does to it apparently. On this mother's Day I'm so happy to have my girls. I couldn't wish for a more loving and full of character duo to have Cal me mama. Thank you girls. Xxx #mothersday #girls #daughte … https:// ift.tt/3dkpTW1 pic.twitter.com/RwVRBbvHR5,0,0,aguzzio,-1
1244017218649760000,HAPPY MOTHER’S DAY! To all the amazing Mams! We hope you’re having a lovely day under the current circumstances. Here is a big virtual bouquet of flowers from Coppi! #mothersday #happymothersday #weloveyou #thankyou #mam #faustocoffee #fausto #sunday pic.twitter.com/ogSJsXBpxd,0,1,JlovesAlexa,1
1245878704544320000,Happy Mother's Day to all our lovely mum's 'Sweet Mother...I no go forget you, for de suffer wey you suffer me' We love you all our mother's, may God Almighty bless you richly #Mother #MothersDay #mum #SweetMother #ArielMothers pic.twitter.com/ihPKtulrBE,0,0,1986Webber,0
1245528161560830000,It may be mothers day but this is my wife Rachel's version of a antidote for covid 19 Happy Mothers Day to all mums out there pic.twitter.com/Ums1FqoJyK,0,0,Go2SleepImTired,0
1245889183538870000,So sad that I couldn’t see my mother in person today - strange times - but was able to send her some flowers and she sent me this lovely picture. Miss you, Mum! Happy Mother’s Day! #mum #mothersday #happymothersday #flowers #bouquet #motheringsunday pic.twitter.com/YXPEl2Jkl3,0,0,LToddWood,0
1245414881605510000,Happy Mother’s Day to this beautiful lady. Youre The Best!! #mothersday #motheringsunday #inspirational #motherdaughter #jamaica #motheranddaughter #blessed #covid_19 @… https://www. instagram.com/p/B-Co2_4Bz5ul NfwQPe6Ra33iOz4echa2QnQ9zw0/?igshid=10c020kfr9n00 …,0,0,LiveGoodProduct,0
1246170947469610000,Happy Mother's Day to my beautiful wife, Emily's amazing mom, @aygul She's as protective of our daughter as a lioness of her cubs! I'm so lucky to have her as the mother of my daughter #MothersDay https:// twitter.com/aygul/status/1 241822630686138368 …,0,0,qx_dsgns,0
1244317156218630000,Happy #MothersDay to all the mothers, grandmothers and motherly figures in the world! The @NGIreland has an excellent collection of #artworks featuring these amazing women so why not read about them today? https:// twitter.com/NGIreland/stat us/1241452143078498307 …,0,8,howarths63,0
1244948586594480000,If I've ever been to your yard happy mothers day to yours too Big shout out to any mums working today and throughout these times you're the fucking goats we love you,0,0,opperi64,0
1244172395776110000,Happy Mother’s Day to my amazing mum I appreciate everything you do for me and @Jmatthews94 love you #mothersday #awesome #amazing #like #love https://www. instagram.com/p/B-CUoGggagF/ ?igshid=1s1wimltq153k …,0,0,zayzanufaa,1
1245000508638740000,Happy Mother’s Day to my humum. Thank you for all the treats, walks, belly rubs, playing and for ‘accidentally’ dropping food on the floor. #love #staffy #bluestaffy #staffordshirebullterrier #mothersday #dog #family #dogsofinstagram #humum #treats #bellyrubs #tummytiggles #happy pic.twitter.com/O0mPNxQUX6,0,1,myApopsis,0
1244238699539440000,Happy Mothers day to the best mum a dad could wished for his little man thank you for everything you do for us https://www. instagram.com/p/B-CVFN2JGcK/ ?igshid=ob9f58nsaqc2 …,0,0,RIZEcareer,0
1245091103289870000,Happy Mother’s Day to all the amazing mothers out there! I know it’s not possible for some of us to see their mums today but our thoughts are still with them, also with mums who can’t be visited today due to the current climate but I’m sure they will understand. #MothersDay #RNLI pic.twitter.com/upzoTS1dof,0,0,CentauriTrevor,1
1245398899277220000,There will be no us without you. You make the world go round, and ensure the security of your children. We love and celebrate your courage our dear mothers. Happy mother day to all mothers and the aspiring ones. #MothersDay,0,0,Hannnerrs_,0
1245073318383960000,HAPPY MOTHER'S DAY! We celebrate mother's and women who do everything for their children especially their young girl to achieve their dreams even in politics. #MothersDay #HappyMothersDay2020 #girlsjustwanttorun #StayAtHomeChallenge #COVIDー19 #StopTheSpread pic.twitter.com/Pz4cVK3UqH,0,0,aromas_by,1
1245540127260230000,Happy Mother’s Day to the mamas, grandmamas and mother figures out there It’s a strange one this year and difficult for many so big hugs to you all! . . . . . #mothersday #mothersday2020 #cassandralanephotography #grandmasofinstagram #happygrandmasday #colourfulwedding … pic.twitter.com/fssU3BE4Wm,0,0,TheBookTweeters,0
1245123958359370000,Happy Mother’s Day! @ghirardelli . To the selfless woman who inspire, motivate and reminds me to be a better person and that everything is going to be alright, every single day. . Te Amo Xoxo N . #mothersday … https://www. instagram.com/p/B-CjnIhHIV9/ ?igshid=nsov9or95uc5 …,0,0,owlpostbooks,1
1244750867909300000,Happy Mother’s Day Thinking of all those people who are unable to spend time with their loved ones today. I miss my Mum and Nan they were so special to me in every way. . I’m so thankful that they were part of my life. #MothersDay,61,1,0,0
1245000491077190000,Happy mothers day to my beautiful angel mummy!! Missing you today and every day! Xxx https://www. instagram.com/p/B-CgP-vhOtJ/ ?igshid=131boo1vf9bce …,0,0,moroccandevil35,0
1244308341595100000,Happy #MothersDay to all the mothers out there taking the full brunt of this #pandemic . Happy #Spring to everyone else! #illustration #comics #coronavirus pic.twitter.com/jUVpF7ZwhC,0,0,BeautySkinYourN,0
1243924280506750000,Happy Mother’s Day from Atlas, we hope you can spend time this Mothering Sunday with you mum whether that be together or from afar , Stay Safe call on 02073833333 to book or download our app available for Android and iPhone ! http:// bit.ly/iPhoneAtlas #mothersday #mothersdaylondon pic.twitter.com/S9E3RBJvfq,0,0,LToddWood,0
1246729096966570000,KGs funniest and wildest shit talking: - Asked Joakim Noah if he can caress his hair like a female - Said melos wife lala tasted like honey nut cheerios - Said happy mothers day u mf to tim Duncan after his mom died (rumour but damn) - Called villanueva a cancer patient Bruh,0,0,CecileRandoing,0
1245119588355860000,Mσƚԋҽɾʂ ιɳ ƈσʅσυɾʂ αɳԃ ʂɱιʅҽʂ [SWIPE>>>] Thank you for your strength, love and sacrifice. We will forever remember. Happy Mother's Day to the best moms . . #nigerianlawschool #MothersDay #HappyMothersDay … https://www. instagram.com/p/B-CjYH6Afk6/ ?igshid=1g7a86lvr7g4k …,0,0,LiveGoodProduct,1
1245629678972360000,Happy #MothersDay to all the badass mothers who look after us gamers! During those times especially, put down a controller and tell your mum how much you appreciate her Shoutout to all mothers in video games who always support and protect their children! pic.twitter.com/SB5T0tfak1,0,0,ItsIndiaGift,-1
1245098882150830000,Happy Mothers Day , Kate. We observe Mothers Day in May here in The States. It's bizarre how that is. I hope your classes are a resounding success. Online exercise classes are brilliant.,0,0,treytrottersofc,0
1244706547839660000,Happy Mothers Day to all of the lovely mummies out there! It’s going to be tough but #SocialDistancing is important as ever to keep everyone healthy pic.twitter.com/kQ40QZfjO2,0,0,WifeWith4Kids,0
1246689329490980000,Happy Mother's Day from a son, daughter, granddaughter and the dog! . #sewalittlehappiness #handmade #handmadecard #keepsake #keepsakecard #personalisedcard #personalised #mothersday #mothersdaycard #recreation … https://www. instagram.com/p/B-VN4nfF0qD/ ?igshid=14yr0amq4ftkv …,62,en,0,0
1244009385912950000,Happy Mothers Day to the best Mum in the world . Sorry I can't be with you today, but we're one of many families who can't get together. But we've many more Mothers Days to celebrate… https://www. instagram.com/p/B-CSutbn6els uDZX5J4Cj_sc3BPcv8o7z3nTbA0/?igshid=1qhql2rph9z45 …,0,0,thekitten63,-1
1246098232339350000,Happy mothers day to Mrs Sophia Maxwell from all of us at Tatafonaija . #TatafonaijaMothersDay https://www. instagram.com/p/B-DCpBIjamU/ ?igshid=1l28ncm6yp6vf …,0,0,M_Otiss,1
1245657043316290000,Happy Mother's day to all the mums and dog mums out there . . #mothersday #dogmum #dogfriendly #woolacombe #mumsrock #devon @Woolacombe https://www. instagram.com/p/B-CuZ0HAWqV/ ?igshid=1st1fab9heo16 …,0,0,alfaroos_store,1
1243955511701070000,Thinking of all those who have lost a mother over the years as I did when I was very young. Happy mothers day , see you on the other side mum. Thinking of you always #mothersday2020,0,1,andreaanderegg,0
1244678065113840000,She's been out in the garden again... Happy Mummy's Day to all the women who are mothers, who've been mothers, or who are the closest thing someone has to a mother! #MotheringSunday #MothersDay pic.twitter.com/3k1lvslPWi,0,0,xoFaithNaomixo,0
1246012132887580000,Happy #MothersDay all - mothers new and old. Everyone is holding their children a little tighter tonight - and some, of course, can’t. https:// twitter.com/acmedsci/statu s/1241738937019895808 …,0,0,Scattyartist,0
1244776631450970000,Happy #MothersDay ......wishing a beautiful sunny day to all the mothers..... all over the world. https:// twitter.com/mreazi/status/ 1241460939792285697 …,0,0,NewOlderMom1,1
1245058466982400000,Happy Mothers Day to everyone who is being a mum to someone - we come in all shapes and sizes, some still here and some watching over us and sadly missed. Wherever and whoever you are know that you are loved #mothersday2020 #grateful pic.twitter.com/9rNvoeqU7P,0,0,LiveGoodProduct,0
1244073348612720000,Happy Mothers Day to all the amazing beautiful Rock & Roll Mothers out there! #HappyMothersDay #HappyMothersDay2020 #MothersDayShoutOut #Mothers pic.twitter.com/8ieo87Wnt8,0,0,GotMommyBrain,-1
1244424330659970000,2/2 I shall be ringing my Dad today and wishing everyone a happy alternative #MothersDay #MothersDayShoutOut #mothersday2020 https://www. facebook.com/FreshAirFriday sNewport/photos/a.335116386645142/1542216735935095/?type=3&theater … pic.twitter.com/va0bp6RU4c,0,0,glorianne329,0
1246092113353360000,Ok, I'm afraid she's going to have to do more videos, showing the footwork so we can all learn because this looks like fun! Happy Mothers Day to your mama,0,0,TheKangarooCrew,-1
1246463411162170000,Spoke to my mum on the phone today. Pleased with myself that I was organised and hid her mother's day presents & card at her house a few weeks back which put a smile on her face when she opened them. Also got lots of cuddles from my daughter today. Happy #MothersDay pic.twitter.com/dZsgCfvRIv,0,0,LToddWood,1
1245443064300070000,Happy mothers day . We honour you for your love, care and service to your children and families #MothersDay #MotheringSunday #MothersDayShoutOut pic.twitter.com/B7nW2gc3Rf,0,0,Rilke_Treasures,1
1245127502835720000,Happy Mother’s Day - here is a virtual card made by my son Joshua #cisinspires #mothersday #stopmotion #proudmum https://www. youtube.com/watch?v=OeYk_P xdTAI&feature=share …,0,17,ShadowDogDesign,-1
1246730488385070000,Happy Mother’s Day to this woman #healthylifestyle #beingtogether #lovinglifetothefullest #greatcompany #mothersday #whiterosesbouquet https://www. instagram.com/p/B-rnbmsBP9i9 MG_uv0DA3SuBvjZdUz_UvQnZY00/?igshid=ftniredhtjac …,0,0,AnthonyLaRusso,0
1245887004128220000,Happy #MothersDay to all mothers of the world. Thanks for making the world a better place! #mothersday2020 Let's help your travel safely, cheaply & timely within Nigeria, visit http://www. journeyman.ng pic.twitter.com/Aea96UjulV,0,0,notmyname02,0
1244163936871760000,Happy Mother's Day to all of the NHS mums who are working today when you should be at home being spoiled rotten (in a socially distant appropriate way)! #MothersDay #ThankYouNHS #COVID19 pic.twitter.com/pqJbVJesVL,0,0,MoM_Mastering,1
1245881587369160000,happy mothers day mothers day isn’t the only day i appreciate you, but today is the one time i will express my love and appreciation for you. i am so eternally grateful for everything that you do. i love you more than anything and more mother bear @Sammii0812 pic.twitter.com/xuu3VYkKyn,0,0,dlhadin,-1
1245668093063360000,“Mom, from feeding and clothing me, to loving me in the tough times, to helping me succeed in my goals– I owe it all to you.” HAPPY MOTHER'S DAY MAMA EZE Happy Mothers Day to all Mothers across the globe. https://www. instagram.com/p/B-CugmXgOPq/ ?igshid=jn76llodhsf5 …,0,0,bossbabeslife,0
1245888343797310000,Happy Mothers day to the amazing @alison .in.the.garden We'll be back together surrounded by flowers soon https:// ift.tt/2QEj9sm pic.twitter.com/3qUrk2Gwgr,0,0,LToddWood,-1
1244308441377770000,Meanwhile I know y'all didn't notice but.. HAPPY MOTHER'S DAY!!!! Our mothers are real superwomen S T A Y S A F E #lifeofpateTM #happymothersday #mothersday #nigerianmothers #quarantine #covid_19 #StaySafeStayHome #mothersday2020,0,2,YangThyMagi,0
1246628647135560000,Happy Mothers Day Card with Heart Flowers - http://www. heroturkopro.com/vector/happy-m others-day-card-with-heart-flowers … pic.twitter.com/3PWQkmX5CR,0,0,LToddWood,1
1246236052035160000,Happy Mother’s Day to this amazing mum. We couldn’t spend the day together - like a lot of people - but though far apart, we shared our favourite pastimes: sitting in the sunshine and sipping something chilled. Love you mama. . . . #mothersday #selfie #i … https:// ift.tt/2xiVN4G pic.twitter.com/Vd5tWuwlHl,0,0,rlmodranski,0
