id,original_text,lang,retweet_count,original_author,sentiment_class
1245024578486890000,Happy #MothersDay to all you amazing mothers out there! I know it's hard not being able to see your mothers today but it's on all of us to do what we can to protect the most vulnerable members of our society. #BeatCoronaVirus pic.twitter.com/va4nFjFQ5B,0,0,BeenXXPired,0
1245758746569130000,Happy Mothers Day Mum - I'm sorry I can't be there to bring you Mothers day flowers & a cwtch - honestly at this point I'd walk on hot coals to be able to. But I'll be there with bells on as soon as I can be. Love you lots xxx (p.s we need more photos!) https:// photos.app.goo.gl/M3vXBLrsCzD4TE bY7 …,0,1,FestiveFeeling,0
1246087356651840000,Happy mothers day To all This doing a mothers days work. Today been quiet but Had time to reflect. Dog walk, finish a jigsaw do the garden, learn few more guitar chords, drunk some strawberry gin and tonic and watch Lee evens on DVD. My favourite place to visit. #isolate pic.twitter.com/GZ0xVvF6f9,0,0,KrisAllenSak,-1
1244802628044940000,Happy mothers day to this beautiful woman...royalty soothes you mummy jeremy and emerald and more #PrayForRoksie #UltimateLoveNG pic.twitter.com/oeetI22Pvv,0,0,Queenuchee,0
1244876274721530000,Remembering the 3 most amazing ladies who made me who I am! My late grandmother iris, mum carol and great grandmother Ethel. Missed but never forgotten! Happy mothers day to all those great mums out there! Love sent to all xxxx pic.twitter.com/xZZZdEybjE,0,0,brittan17446794,-1
1244524215597820000,HAPPY MOTHER’S DAY! BRATZ WORLD FAMILIEZ YASMIN & HER MUM! (PORTIA) #bratz #bratzworldfamiliez #bratz2008 #bratzkidz #bratzyasmin #bratzportia #theonlygirlswithapassionforfashion #bratzdolls #bratzcollector #happymothersday #mothersday #mothersday2020 #azdoesmakeup pic.twitter.com/5m1T81zhpU,0,0,chotia_mudit,0
1244202136566730000,Happy Mother’s Day to all you wonderful mums out there! #mothersday #cupcakes #supermums #traceyscakecraft #couturesugarpaste #saracinouk #hinckley @Tracey's CakeCraft https://www. instagram.com/p/B-CUzHjg-Au/ ?igshid=lf3elmlv7q7g …,0,0,essentialartss,1
1244340660943140000,Show me a mother of two as sexy as Rosie Happy Mothers Day beautiful Rosie @officiallrosie I love you #HappyMothersDayRosie #HappyMothersDay2020 #WhyILoveRoksie #Roksie pic.twitter.com/6oMZGHcIVe,0,0,gmassaro7,1
1244049435358910000,To all the mothers, grandmothers, aunts, sisters and women in our lives who care for and love us unconditionally, Happy Mothers’ Day ! #MothersDay pic.twitter.com/ejatt1aH4z,0,0,LToddWood,1
1245780294545920000,To all the mothers around the World, Gas To Health Initiative wishes them a Happy Mother's Day! - #gthi #mothersday2020 #MotheringSunday #MothersDay #lpg #motherhood #motherslove #gastohealth #argus #lpgn #nigeria #cookinggas #Cooking #MothersDayShoutOut #mothers #mama pic.twitter.com/csq1jOiC1z,0,0,LiveGoodProduct,0
1246526203361710000,Happy Mothers Day To all the Mothers around the word. #mothersday #mother #mom https://www. instagram.com/p/B-EjXQaFtja/ ?igshid=dcgderf6tgj2 …,0,0,Dodgers_jedicid,0
1246540411310610000,HAPPY MOTHERS DAY , CHRISTINE | DAILY LIFE For the full video click the link below. If you enjoy this video, please share it and click Subscribe on YouTube for more like it. Then click the Bell icon to get notifications of new videos. https:// buff.ly/2QAIlzV pic.twitter.com/Askk1nKFvu,0,3,Mekialaya,1
1246119037861600000,Happy Mother's Day! Check out my latest blog at http:// sallycleggart.co.uk/index.php/sall ys-blog/ … http:// sallycleggart.co.uk #art #newart #artist #newartist #blog #newblog #mothersday2020 #mothersday #coronavirus #COVIDー19 #Isolation pic.twitter.com/bqsWJkzPoa,0,1,lindab142,1
1244369008067040000,Happy Mothers Day to everyone tuning in. This is the 4th Round game between me and @CastigersJ Live coverage on @Twitter , maybe one day @SkySportsRL or on the OurLeague app,0,0,RudieObias,-1
1245074154891570000,Happy mother's day! I got a playdoh worm cake from my beloved 3yo o.O at least he warned me to only pretend eat it lol #MothersDay #MomsOfBoys #preschooler,0,1,PKellenbarger18,0
1246037658142270000,Happy Mothers Day to all you amazing Mums out there! Keep being awesome! It's probably not been your normal mothers day but a mothers love is one that can overcome even the toughest of challenges. Hope you've all… https://www. instagram.com/p/B-C-0nZlrVe/ ?igshid=1e6tgbc5wrbx3 …,0,0,D_Cassandra_D,0
1243986968943280000,A poem I’ve written for my wife on Mother’s Day. Happy Mother’s Day xxxxxxx #family #motherhood #mumlife #motherday #mum #mother #happymothersday #treatyourmum #mothersdayflowers #sundaylunch #mothersday pic.twitter.com/QFPelF7OLb,0,0,andreaanderegg,0
1244334111382280000,Happy Mothers Day ! We hope your mums aren't planning to do any work around the house today! Surely it can wait until next week? #plumbers #heatingspecialists #mothersday #mothersday pic.twitter.com/PnunD1pPl4,0,0,RaffaellaPino,-1
1244655853212520000,Wishing all our Mamas a relaxing Mothers Day in these challenging times ​ ​ Happy Mother's day. ​ ​ #sweatymama #postnatalfitness #postnatalbody #sweatymamaclass pic.twitter.com/d9CImgzxcl,0,0,review_prime,1
1244590210626790000,Happy mothersday to all those celebrating today. This is my most favourite woman in the whole entire world and I love her to pieces Big hugs to those whom today might be hard for xxx https://www. instagram.com/p/B-CY08zA0kB/ ?igshid=wok5zcr2y5am …,1,en,11,0
1244331765503860000,The hands that always lift's me when i fall. The person that always supports me for every second of my life. My Queen my everything my mother. HAPPY MOTHERS DAY,0,0,TheKangarooCrew,1
1244484044311720000,Happy mothers day to my strong, adorable and hilarious muma, antons muma in heaven, antons sisters, my amazing friends with beautiful babies, my aunties, my godmother, my nonna, my stepmum and my grannys. Love you all unconditionally forever pic.twitter.com/k4twjBPbYj,0,0,grouptherapy33,1
1245044394744580000,Happy Mother's Day Lisa @chopdrog58 Fantastic Work from Team @chopdrog58 looking after the staff in the Newgrange ward in the Lourdes hospital #LouthChat #feedthehores #MothersDay pic.twitter.com/VN33uAwanx,0,0,momstsmodel,1
1245880172185650000,Happy mothers day to this beautiful, hard working ,brilliant ,perfect support system ,my padi and fantastic wife and friend ......Thank you for all you do for me and the kids...God bless you ......and I love you . https://www. instagram.com/p/B-C37IwJcNr/ ?igshid=zpfxw5j8zmt7 …,0,0,leticiakane4,1
1244378331358910000,Today we celebrate a love so pure, inexhaustible and unconditional. We thank our mothers for all they’ve done in making us who we are and who we’ll become. Happy Mother’s Day!! #MothersDay #HappyMothersDay #Norrenberger pic.twitter.com/JQmvYuSuCP,0,0,LToddWood,0
1245377283193360000,Happy birthday little cute cupcake (bear grey payne) wish to see your beautiful face one day love u & your amazing dad @LiamPayne sooo much also happy mothers day to his gorgeous mom @CherylOfficial be safe . xxxxx https:// twitter.com/LiamPayne/stat us/1241729938136457219 … pic.twitter.com/is3fjT9MMr,0,0,BrianDaltonCRE,0
1244490645030530000,Happy Mother’s Day to my incredible mother. Happy Mother’s Day to al the mothers around the world. It’s out now! Link to my YT video: https:// youtu.be/c93qGqyh0Hw #mothersday2020 #MothersDay #YouTube #spokenword,0,0,HaremDesign,1
1246142988818020000,Happy Mother’s Day to every woman that has trained, encouraged, corrected, cared for or provided for any child Indeed, you are the one that should be celebrated on mothers day , not just woman that has given birth to… https://www. instagram.com/p/B-DG2llnnM7/ ?igshid=1f23z5mgdcikt …,0,0,LiveGoodProduct,0
1245784332016520000,You could have just stopped at “ Happy Mothers Day ” and left it at that. Unless you were seeking attention, which of course I am sure you wouldn’t have done unnecessarily, right?,0,0,RoadsportHonda,0
1244194811822910000,Happy mothers day to all those mums whos children can't be with them today. My son Dylan lives in heaven I wish I could see him for one more hug. I wish I could tell him how much I love and miss him. Huge happy mothers day to your mum too.,0,0,Zennia_Art,-1
1244822550976380000,Exactly what my late mum aka hype mama would do in this circumstance. Sure you all can relate. Happy Mothers day to all women. You truly rock. Ladies, I salute you all. Thanks for being here. #@summit_gate … https://www. instagram.com/p/B-Ca236lS4l/ ?igshid=1l5melyquco6z …,2,en,0,0
1245924297618660000,Happy Mothers Day ! 's To all those special Mum's who may not have seen their loved one's today. We Love you. Stay Safe. pic.twitter.com/OAm32PTpzO,0,2,FSonnenberg,-1
1244924303566570000,A tweet for my wonderful wife and mother of our 4 daughters.. She sadly lost her mum last year so suffering a little today.. ..I hate to see her sad.. Here's a loving happy Mothers Day for her mum Shirley and all you're much loved mum's not with us today...,0,0,sarah_berryman1,0
1244711744712270000,Happy mothers day to all the mothers at this very strange time, especially 51.walsh, catherinemwalsh20 and bailesae you guys set the standard!! @Old Stratford https://www. instagram.com/p/B-Cb1r4D1_Kc wn9a_vQzxtCkRXEd9Eu4X6bZ2o0/?igshid=1wzimo2v391rp …,0,0,andreaanderegg,1
1246486218277150000,Mother n law bday #SocialDistancing #COVID19ireland #coronvirusireland happy mothers day Liz love the sound of my own voice #aintnoxfactor pic.twitter.com/TrQxSuY32B,0,0,SBNYDESIGNS,0
1245329227483760000,Happy Mothers Day dear friend, despite the difficult times of life, trying to stay strong and motivate each other, keep busy and get creative during free times. I saw sunshine today after long time and got myself… https://www. instagram.com/p/B-Ck8klDVMQ/ ?igshid=10nk1tzjy95ns …,0,0,CentreJuhi,0
1244640713989660000,Thank you for our fanastatic neonatal team , many of who are mothers working today. happy mothers day to all in umhl. @ULHospitals @Naro_Imcha @RizKhanahmed @OHennebry @DeirdreOConnel9 @BeirneIrene https:// twitter.com/DeirdreOConnel 9/status/1241642448033636352 …,0,12,SidRothTV,0
1244233878925200000,My nan....my world ... i miss you so much... although u would have hated the world as it is now ! happy mothers day to all the mums out there have a great day pic.twitter.com/37ozUIinOH,0,0,CuteCalendar,0
1245439657187270000,Wishing a very happy Mother's Day to you all. It might not be a day that you had planned, but I hope you have a lovely time xx . . . #mothersday #lovemymum #lovebeingamum #dancemums https://www. instagram.com/p/B-Cp2lznlj0/ ?igshid=2n7w60v32nao …,0,0,HisHersTeez,0
1244049742755180000,I am with you. I'm in Australia and mothers day here is the 10th May which happens to be my big birthday. So I have to wait till next year and pretend that's my big birthday. Somehow loose a year. Guess that's when I start lying about my age. Happy Mothers day to your mum.,0,0,LToddWood,1
1245072586779720000,Happy Mother’s Day Mum I love you so much and even more in my heart. #happymothersday #happiness #adorable #mothersday #sportacus #sportamother #mothernature #mother #motherandson #motherslove #motherday #mom … https://www. instagram.com/p/B-CiB0bHEL0/ ?igshid=u6zet4brgeb …,0,2,PKellenbarger18,0
1245425701039170000,A big "" Happy Mothers day "" to all mums & Grandmums out there.Sadly My mum has passed away,I do miss her on days like today,so never forget to tell them you love them while you can,you only get one mum and one day she will be gone!,0,0,SassyBeadshop,0
1245117501907720000,Happy sunday and happy mothers day dont forgot to call or skype your mam today. Here's a little kettlebell workout for ye Wash those hands and stay at home. Dont forget about social distance aswell. We got… https://www. instagram.com/p/B-CiY6QBOIC/ ?igshid=sn0ue6xit0l9 …,0,0,LiveGoodProduct,-1
1245443332483970000,From all of us here at Abode Manchester we would like to wish all you Mums out there a very Happy Mothers Day . However you spend your day stay safe and look after yourselves. pic.twitter.com/L4bQTXpRGz,0,0,KaySeeley1,-1
1244781468804700000,Happy mothers day to all you brilliant mums. (here is a Rhododendron bonsai I lent my wife for mothers day , I am having it back though!) #mothersday #bonsai #rhododendron #onloan pic.twitter.com/uWYRRJ1REA,0,0,kidnoutdoors,0
1244623640127290000,To all the phenomenal Mammy's out there, thank you for all you've done Happy Mother's day #mothersday #thankyou #CoreIreland pic.twitter.com/GBCWY9mrIv,0,1,TrendingNowGift,-1
1244209111773950000,Happy Mothers Day to my loving mom, thank you for all what you have done to our family. I know you are on heaven now but all Your memories still on my mind ILOVEU SO MUCH MOM AND I MISS U OH MY GOSH I WAS CRYING WHILE MAKING THIS MESSAGE @Tabachichi27 @Rna4L @VitaminC_08,0,1,JMM_Judaica,0
1245103092955090000,#sepsis Maggie wishing all the amazing women out there a happy #MothersDay special shout to all of the awesome ladies that are supporting our #NHS #NHSCovidHeroes #StayHomeSaveLives pic.twitter.com/gbzhLVyGd3,0,0,MontessoriMom_,1
1245821843984000000,Wishing a very Happy Mother's Day to my wonderful Mam. I'm so lucky and so proud to be your daughter!! I love you and am always here for you just as you are always there for me. Thankful for you today and everyday!! xxxXxxxXxxx #MothersDay #Mam pic.twitter.com/6uLkzVRulB,0,0,LToddWood,1
1245898322000240000,Happy mothers day to the best mum/mother in law/role model/best friend & amazing nanny in the world We hope you have a lovely relaxed day, thank you for everything you do for all of us… https://www. instagram.com/p/B-C6zdFBelj8 rFhF0yAfStxWcuOg9_tzhOpNbM0/?igshid=gbpw941rjpn8 …,0,0,elly71,0
1245915147241220000,Coro and it's worries almost made me forget celebrating today, but God pass you koro, and love to the amazing people who made me remember, Happy mothers day to all mothers out there stay safe pls https://www. instagram.com/p/B-C7ilCJVqx/ ?igshid=w3kfua833eie …,0,0,crafts_mar,1
1246136893370220000,Playtown’s Mammy Was Very Happy With Her Flowers Today We Hope Every Mammy Had A Great Day We Missed Sharing A Coffee With You All Today Whilst The Kids Played & Can’t Wait For Better Times #mothersday pic.twitter.com/BNzj0KJdZj,0,0,LiveGoodProduct,0
1244139559316850000,As a special #MothersDay treat, I get to watch Dinosaur Battles with #MaximusTheGreat Happy Mother’s Day to all the Mammas out there, have a blessed day #HappyMothersDay2020 pic.twitter.com/2FODAj7nP2,0,0,barcode79,-1
1244859545609960000,Happy Mothering Sunday to all you lovely mums out there. Sending all our thoughts & love. #peaksandwiches #mothersday #sunsoutgunsout https://www. instagram.com/p/B-CeQSUlc0z/ ?igshid=12ndf4kqfsbyf …,0,1,ItsIndiaGift,-1
1246479799238960000,@KensingtonRoyal Good Afternoon Editor And Princess Catherine Middleton Happy Mothers Day And To Your Beautiful And Very Precious Mum Mrs. Carole Middleton i Love All Of You Very Much And All Your Royal Cambridge Family , enedina silva,0,0,NeldaMaysPhoto,1
1245876448147260000,Happy mothers day to @sinach from all of us at Tatafonaija . #TatafonaijaMothersDay https://www. instagram.com/p/B-C3U0ADjIk/ ?igshid=1rhhhcv5afqdv …,0,0,1986Webber,0
1244281932403350000,Happy Mother's day to all those wonderfully mummies out there! Hope you all have a super day, like no other before. Keep smiling, stay safe, stay together. #family #mothersday #strangetimes #enjoyyourfamily … https://www. instagram.com/p/B-CVhUMF2eF/ ?igshid=bzaofedmhjgr …,0,3,ShadowDogDesign,1
1244956122181760000,Happy Mothers Day ! I am @palmitosparkGC as I just love how the birds come and sit on your head. I am not disappointed. It's a beautiful day filled with love&gratitude. Let me know what fun ‘places’ you’ve been to today. Get your imagination running&share some photos. pic.twitter.com/mVk32hGLdT,0,0,kimbruce_,1
1246138621507380000,Happy Mothers Day to my special mama of my fave photos x tilly_mint_silver_ : : : #mothersday #lakes #cumbria #vintage #oldphoto #baby #mother #mamma #mum #mumsofinstagram #flowers #underthefloralspell … https://www. instagram.com/p/B-DGNu_n2nb/ ?igshid=e3vs2w5dc4he …,0,0,lolamiller774,1
1245879027564500000,Happy Mothers Day to my amazing Mamma Bear Not only is she mum to the 4 of us (Me Sam Tom and Jake) but she is also Mummy Dee-In-Law and adopted Mum to several of my friends too!! Cannot put into words how much… https://www. instagram.com/p/B-C3ml1As5-/ ?igshid=lzf1nhlhvij6 …,0,0,KornellCameron,-1
1246133761714070000,Dear Moms “ Happy Mothers Day ! Thank you for everything you’ve done for us. It’s more than we can ever repay you!” #shoesellerinlagos #shoesulove #shoelover #happymommy #mothersday https://www. instagram.com/p/B-DFRSHB-sE/ ?igshid=1hla7gxocduw6 …,0,0,LToddWood,-1
1244697253710890000,Happy #MothersDay Momma A & to all the mums: Thanks for protecting, teaching, loving & providing for us! You’re the best! To anyone wanting to show appreciation to their mum today, remember they need love & protection too, so find a way to show u care & ‘spread love not germs’ pic.twitter.com/1TqUmtnDOj,0,0,baby_toppy,-1
1243987602899970000,Happy Mothers' Day to all the Mums in Surrey Wing. Thank you for your support in developing the Next Generation. Whether you are a volunteer or a mum of a cadet (or even a mum of a volunteer) your support is invaluable. pic.twitter.com/nJjhBu4JJd,0,1,tpiratetreasure,1
1245758240954220000,Wishing all the mammies out there a very Happy Mothers Day . It's tough being a mummy so make sure you lord it over all of us today #HappyMothersDay2020,0,0,LadybugsTwo,0
1246514676843890000,It's the world's most difficult job No sick leave, no days off Yet you do it with a smile Always ready to protect Thank you for all you do . Happy Mothers' Day !! . . #MondayMotivation #mondaymood #Nigerians #natnudO #HappyMothersDay #mondaythoughts #COVIDー19 pic.twitter.com/VgtvVLHywo,3,en,1,0
1244226143739410000,Happy Mother’s Day! To all the amazing Mums out there! Here’s some gorgeous #hearts and #flowers #nails ⁦ @SwoonNails ⁩ #Mothersday pic.twitter.com/lxpOV7bHfq,4,en,0,0
1244831577164700000,Happy Mother’s Day, to all the mother’s in the world and those who are no longer with us. @TOJ2020 #mothersday #happymothersday #sunday @London, United Kingdom https://www. instagram.com/p/B-Cd84pABqs/ ?igshid=2np5728hl3o …,0,0,crossesmegs,0
1246533103306400000,@thismorning pls.pls pls ..say happy mothers day to doreen blandy ...a mum of 5. And many grand children .great grand children ...thank you stay safe everybody,0,1,TheKangarooCrew,1
1244806148601120000,Happy mothers day to all the amazing mummys, and mummys to be hope you have a lovely day. Cant wait to get my little guy back later pic.twitter.com/op3RT52MTX,0,0,jh20182018,-1
1243991498267520000,Well, as I posted that old photo of Sam with her mum earlier, Sam has insisted that I post an old one of me with my mum too. Here we are, along with my sisters (twins, obviously!). How were we not considered as an alternative cast for The Shining? Happy Mothers Day all!! pic.twitter.com/tMOZRlYsbB,0,0,Nanny_Institute,1
1244272424113310000,Rang mum to wish her a happy Mother’s Day, ended up giving her (what felt like) a lecture about social distancing! #mothersday #sorrynotsorry these 2 pic.twitter.com/lNAn3OPynk,0,0,Com4tworldcakes,0
1246049853974740000,You are enough. The rest, the worry, the 'right' way to do things is fluff. Happy Mothers Day https:// twitter.com/hurrahforgin/s tatus/1241691845446565888 …,0,0,clairemdesigns,0
1245881731368060000,#WaterSafetyInTheHome A little something I wrote last night while the tears were streaming down my face. Happy mothers day to all those mummies missing their children right now. Xx pic.twitter.com/4GfpUty1U7,0,0,MomCBS,-1
1244130662283700000,Happy Mothers Day to my sis. I'll forever be you shadow. Amazing role model Super stylish Stright with no chaser with @Ieshie2 pic.twitter.com/1rEUy8oFDw,0,4,iConversations,0
1246238069239370000,Happy Mother’s Day to this beautiful woman aka my wife!!! I couldn’t have asked for a better woman to have kids with. Thank you for being so incredible all the time. They appreciate you and so do I!!! #mothersday … https://www. instagram.com/p/B-DO8GNAs0W/ ?igshid=1leaj9xp22f9n …,0,0,BeezieDuck,1
1246226980359540000,I've got the trinity blessing Mother Wife @kintyt Daughter Happy mother's day to the amazing trinity #ZeroHunger #foodsecurity #FarmLab2020 #MothersDay pic.twitter.com/GeG46oADFK,0,0,eBooksHabit,0
1246245357400540000,"" Happy Mother's Day to the best mother anyone could ask for. Thank you for everything you do for us. Love you lots and lots x."" @KeatesyL #MothersDay pic.twitter.com/UQECDusemM,0,0,LToddWood,0
1246590890778530000,There's no greater love than a #mother 's love. For the sleepless nights, unending care and sacrifices too many to count, we celebrate our super-moms today. Happy Mother's Day. From all of us at FCMB Asset Management. #FCMBAssetManagement #VisionBeyondBorders #MothersDay pic.twitter.com/RrlJZZnALq,0,0,ARCProGroup,1
1246368252458130000,Happy Mothers Day to the Trans Women who have protected and are still protecting the abandoned LGBTQ youth thrown onto the streets by their biological mothers - fuck you Julia https:// twitter.com/JuliaHB1/statu s/1241676268342521857 …,0,0,mementoes4u,1
1244419360422130000,Happy Mothers Day , Mummy! Nearly 90 and still going strong and able to spend a whole evening on the dance floor. #motherdaughter #mothersday Xx @Cakes by V https://www. instagram.com/p/B-CXVCRJk_2/ ?igshid=178sx0pibll3u …,5,en,2,0
1246461178617920000,Happy Mother’s Day to all Mums out there. I’m truly blessed to have these 3 beautiful women consistently showing me and my son unconditional love.⁣ ⁣ Also sending my love to all those who’ve lost their precious Mums. ⁣ #mothersday pic.twitter.com/Vq3e81dAEi,0,0,LToddWood,0
1244092944455540000,My little mischievous bean, keeping mummy very happy on Mother’s Day with her playful fashion/dressing! . . . . #mothersday #littleone #loveher #smile #silly #dressup #fashion #thatsmygirl #babygirl #daughter #muma … https://www. instagram.com/p/B-CUCg_DKyr/ ?igshid=7oof80wboj9n …,0,0,meer_emma,0
1246674343322620000,So today is Mothers day ...We legit celebrated Mothers Day 2 weeks ago. This thing gets me confused errytime. Happy Mothers Day to all Mothers,0,0,EverydayMama3,0
1244053452294140000,Happy Mothers Day mama! Thank you for showing me early that nothing good comes easy! One definitely needs to put loads of hardwork and sacrifice into the grind! I appreciate and celebrate you now as always! Love you… https://www. instagram.com/p/B-CTh8UFsJy/ ?igshid=1hxmbpcxdiwjj …,0,0,LToddWood,0
1245709706573670000,So been to wish my 93 year old mum a Happy Mother’s Day. Stayed in the driveway keeping a safe distance. Glad she understands and can’t wait until this is over so I can give her a big hug again. #staysafe #COVIDー19 #MothersDay,0,0,ivritpuri9,0
1245089748349220000,Tunde Demuren sends Toolz Happy Mothers’ Day message amid Separation rumours https://www. herald.ng/tunde-demuren- sends-toolz-happy-mothers-day-message-amid-separation-rumours/ … pic.twitter.com/2RYdUpYSqU,0,1,howarths63,0
1246151808562730000,Happy Mother’s Day from all of us at L’Atelier Green Paris . . #mothersday #mum #love #kindness #mother #nakednailscollection pic.twitter.com/PyYfffFBPK,0,0,ColoringAddicts,-1
1244049389586450000,Happy Mother's Day And with the whole family likely to be at home indefinitely, let's spread into the garden http:// ow.ly/AgXR50yPQzl #wfh #workingfromhome #luxurygardenfurniture #outdoorfurniture #kingsroad #mothersday #familytime #chelsea #interiordesign #moderndesign pic.twitter.com/lbXLxLBRGY,0,0,LToddWood,-1
1244354893680380000,Happy Mother’s Day. As we’re not able to do so in person I thought I’d send you a virtual celebration. Yorkshire style! Enjoy. #mothersday #virtualhugs #fishandchips #champagne @Paible, Eilean Siar, United Kingdom https://www. instagram.com/p/B-CWj0GlFik/ ?igshid=8ltss3tix574 …,0,1,andreaanderegg,-1
1245910163200110000,Happy Mothers Day to my lovely mum and all other mums out there (including my Aussie mum clarke6478 ) who may be celebrating alone and isolated. All I want to do is give my mum a cuddle on this special day but out… https://www. instagram.com/p/B-C7ar_pnkv/ ?igshid=8xwspnc7wk72 …,0,0,saluxcloth,-1
1245706436589610000,After a few technical hitches, also managed to get Mother-in-law to do her first FaceTime. Demonstrated perfect multi-tasking by taking a call from her neighbour at the same time on her landline. Well done, M-I-L! Happy Mothers’ Day ! Nice to see you. C : ) xx pic.twitter.com/eJHnll4DWZ,0,0,JennysNoodle,-1
1243932538986430000,MOTHER'S DAY | Fitzgerald Menswear Waterford Wishing all the Mam's a wonderful and Happy Mother's Day. Wishing you all a very safe and lovely day. #mothersday #WL #special #heart #mam #mother #mammys #day #sunday https:// ift.tt/2Ua4PKr pic.twitter.com/Z1Fwb70HKa,0,1,VVerrico108,0
1244017762902650000,I would like to wish all the mother's out there a very happy mothers day and hope you have a lovely time despite the current world crisis all us children love you for all you have ever done for us thank you. pic.twitter.com/nS19X4K4I3,0,0,ClaresfnkwrLEGO,-1
1244918249944420000,#MothersDay Happy mother's Day mum X Today we can't hug we can't kiss, have to keep you safe Today just a wave through the window so I can see your face It's the best thing to do and I hope and pray That I'll be able to kiss and hug you next mother's day. Love you mum XX,6,3,0,0
