id,original_text,lang,retweet_count,original_author,sentiment_class
1245420804583620000,Happy Mother's Day Maria Luisa Garcia Bartolomeu and all the mothers out there. https://www. youtube.com/watch?v=94SIN6 8qgSI … #MothersDay #vinteum #Familia21,0,0,islsnacshop,1
1244786521712070000,In my mind i kept on hugging & telling my mum happy mothers day ,but i could not just say the word,my typical angry mood was the reason. I really want her to know i love her, she is everything to me. I dedicate this to my mum for always putting up with me @Johnnydrille #ForMamaNG pic.twitter.com/nIWbNSAQJG,0,0,LToddWood,-1
1244103760445620000,The one morning I don't come on here right after i wake up & there's OT7 pictures MOM I HOPE YOU ENJOYED YOUR MOTHER'S DAY BREAKFAST! I WAS LATE TO THE OT7 IS HAPPY PARTY BECAUSE I WAS COOKING IT! ...but it's ok, happy mothers day to all the moms,0,0,BabyMDoctor,0
1246151452336280000,Anyone who says Mums can do anything clearly hasn’t tried robbing a bank with mine... Happy Mother’s Day! #MothersDay pic.twitter.com/QPdYoqRvqP,0,0,LToddWood,-1
1246233560945770000,Happy Mums Day, Carol. Please enjoy your special day. Thanks for all you do for so many others. I know how much your family fancies you—and for good reason...Cheers! #mumsday #MothersDay #mothersday2020 pic.twitter.com/w3tJJBCUQl,113,en,0,0
1245423729225670000,أمي أجملُ مافي هذه الدنيا #يوم_الأم #happy _ mothers_day #علوم_الدار 21/3/2020 @Abu Dhabi Media https://www. instagram.com/p/B-Co7pMJNOf/ ?igshid=1dzyz9s0j6vrv …,114,en,0,0
1246158792695390000,Happy Mothers Day to all the powerful Mamas and Mamas to be in the house. __________ With all that's going on, the World will not celebrate as usual but we must take a moment to celebrate ourselves while staying… https://www. instagram.com/p/B-DIyvhFW12/ ?igshid=13pqlwsgxwmti …,0,2,howarths63,0
1244482021792990000,Happy mothers' day ! Thank you to those amazing workers in health and care going to work instead of spending the day with loved ones #letspulltogethertostayapart,0,3,sistecbd,0
1244174871300660000,Happy mother's Day to my mum and every mum in the country. It's a trying time, but it will be over soon. #happymothersday #mothersday #motheringsunday #covid_19 #stayhome https://www. instagram.com/p/B-CUo_zhP7g/ ?igshid=1v997j7oqdguq …,0,0,Funtasticdayy,0
1246609751955270000,dandad: Mum’s the word. From the soppy to the downright silly, here are our favourite creative campaigns that pay homage to the hardest job in the world. Happy Mothers Day . https:// fal.cn/37de8 pic.twitter.com/HOGPjFJujg https:// twitter.com/dandad/status/ 1241726355131305985 …,0,0,LanaDT,0
1246318393600490000,Happy #MothersDay to my beautiful nan. Its been almost 13 years since you left and I miss you so much every day. I hope grandad is spoiling you up there and cracking his dad jokes,0,0,qwikad_buy_sell,-1
1246064199173840000,You can tell you’re young and don’t understand lol. Your significant other always says Happy Mothers Day or Father’s Day to the mother/father of their children lol.,0,0,GotMommyBrain,-1
1246167468420330000,Happy mothers day #motherearth often taken for granted but without you nothing is possible! I hope the #masses reset their chain of thought and actions during this time. #gratitude #mother #planet #earth #thoughts … https://www. instagram.com/p/B-DJt4QAUVp/ ?igshid=11uah5ioeym9o …,0,0,sasha_sweeps,-1
1244692385239430000,Happy mothers day to all the mums out there and heres to the goverment stop putting all bad stuff on tv about the virus at least talk about good stuff more please,0,0,LoveluK77651882,1
1244049366500940000,During difficult times, let's not forget the positive things in our lives. Happy Mother's Day to all of the amazing mothers in the world! #HappyMothersDay #MothersDay #LawFirm #Mothers #Family pic.twitter.com/KyVwwX83q5,0,0,LToddWood,-1
1246049381947610000,Happy Mothers Day to both my mum, and to my little boys Mama. Sorry there are no fresh flowers on the table today - Alex and I will make it up to you. xx #flowers #mothersday https:// ift.tt/2JjEGmp pic.twitter.com/wJ9iCeGHHI,0,0,clairemdesigns,-1
1246149682260300000,Happy #MothersDay to in my opinion one of the most incredible mothers to exist @MrsAnneTwist . Your gentle eyes & eternal mother love can even be felt by us. Thank you for blessing us with your two exceptional children & for being the best mother anyone could imagine. Stay safe xx pic.twitter.com/0c8X6WB7Pv,0,0,LToddWood,-1
1246014663525010000,Happy Mother’s Day to all the mothers out there but especially to the main Ma Mary I have a lot to thank you for, especially my sense of style which you can see here... #mothersday pic.twitter.com/dho3WKXfpX,0,14,DonnaEverything,1
1245864504853820000,To the moms we have, moms we've lost and moms we've choosen, we say Happy Mother's Day! Thanks for being awesome. #mothersday #motheringsunday #boookman #bookmaniac #bibliophiles #eachforequal #bookreader … https://www. instagram.com/p/B-C2zkTAuEo/ ?igshid=16taivbbrf08o …,115,-0.3643299313,0.0614393786,0
1244032334875230000,Before I used to appreciate people saying Happy Mothers Day to me but since Zaon turning Heavenly 10, It seems as though it’s getting abit harder to accept,0,2,okayest_momma,1
1245848505488310000,To all the wonderful Mums around the world, Happy Mother's Day Lovelies xxx #TheGeorgeMichaelStory #MothersDay #Lovelies4Help #StaySafe pic.twitter.com/l93gZbJMH4,0,1,TVTango,0
1244359746674730000,Happy mothers day to all you awesome mums out there! Hope you all are safe and well and we all you for all the awesome things you do for us! X #mothersday #gamers #love #soulrisegaming https://www. instagram.com/p/B-CWnzRnT78/ ?igshid=17nocnfeg0wy4 …,0,0,lshank,-1
1246628387403240000,my mum got angry at me for not wishing her a happy mothers day . happy mothers day to the woman who banned me from watching my favourite youtuber because he's slightly overweight.,0,0,LToddWood,0
1246133899744460000,HAPPY MOTHERS DAY #moreblessings #happymothersday #oluwaisinvolved #myheros #menthol #GodisAble #mycelebrities @Pittsburgh, Pennsylvania https://www. instagram.com/p/B-DFXcQH_qz/ ?igshid=1ws9ydg4840hj …,0,0,LToddWood,0
1245011296208260000,Happy #MothersDay to all our Na Fianna Mammies - Lá na Máthar faoi shonas do gach aon Mamaí de chuid CLG Na Fianna #staysafe #Social_Distancing #NaFiannaAbu pic.twitter.com/p4b2TcScoV,116,en,0,0
1244033747441370000,Happy Mothers Day to all Everton mums. As we all know, they are the best mums in the world A different kind of Mothers Day for the majority, but all for the greater good Stay in and stay safe #UHTPodcast #EFC #COYB #Everton pic.twitter.com/ysimfOY4Rk,0,0,MMC264,0
1246490329269910000,Just spent a 2 hours setting my mother home working station. Thank you #coronavirus A bit late late but a very happy mothers day to her! pic.twitter.com/MZWdtrwAfL,117,1,0,0
1245114713853190000,Check out my Gig on Fiverr: sing shower happy birthday song or any message https://www. fiverr.com/share/kLEe9g #テセウスの船 #5baje5minute #Covid_19india #SokağaÇıkmaTürkiye #JanataCurfew #MothersDay #ChildishGambino #ノクチル,0,0,LiveGoodProduct,-1
1244649765897480000,Happy Mother’s Day to all you wonderful mums out there. Whether you’re running baths, packing lunches, being a taxi driver, cooking dinners or ironing clothes – you're doing just fine. Tag a mum to tell them you think they’re doing a damn good job! #MothersDay #MotherlyLove pic.twitter.com/tqAxEk9UXc,0,0,gildthegarden,1
1245212103100840000,My mum just said she wanted a glass of ribena that was ‘quite weak and very cold’ and then went ‘just like me really’ happy mothers day part 2,0,0,JustCallmePiink,0
1245908165629230000,Happy Mother's Day to all the wonderful mums out there! We love and appreciate you every day not just today. #mothersday #mothersday2020 #thankyou #bekind #mum #wellbeing pic.twitter.com/dAHHjoe9Eg,44,0.1005978336,0.3600148299,0
1244787490906490000,Happy mothers day to all the amazing mum's out there!!! Shoutout to the amazing Mum's that Stream!!! @BluefishTV @itsAmalyy @Vixenxx @legendsqueeniee,0,0,ButterflysAttic,0
1243919776503590000,Happy Mother’s Day to this absolute legend You are always there supporting us in everything we do and we couldn’t do any of it without you!! You are our biggest fan and we are yours!! we love you more #mothersday #mybestfriends #legend #firefighter #mum #lucky pic.twitter.com/tiEKt72ZTC,0,0,andreaanderegg,-1
1245395894234690000,Today Is Mothers Day In The UK. I Just Would Like To Take The Time Out To Say Happy Mothers Day To My Mom AKA ""Mama Lioness"" & To All Other Queens Out There Who Are Blessed With The Title Mother & Role Of Being A… https://www. instagram.com/p/B-CoEcIgR8q/ ?igshid=b5weypi1n8fz …,0,0,badbball,-1
1244720164563800000,Happy Mother's Day to all the amazing mums out there!!! . . #mothersday #amazingmums #motherslove #celebrationcake #cake #Tamworth #cakedecorating #cakedesign https://www. instagram.com/p/B-Cb82EBiwD/ ?igshid=1qsod34s1mqvk …,118,en,0,0
1245472777647410000,Happy mother's day y'all!! I have been blessed an hour of fresh air with a few of my family in the sunshine! The rest involves vid chat! Love them all & i feel so lucky to have so much love xx #MothersDay #mothersday2020 #COVIDー19 #StayAtHomeChallenge #SocialDistancing pic.twitter.com/IrMDDq7yfS,0,0,Toyalynn7,-1
1244613778962090000,Happy Mother’s Day From us all at Irmak BBQ we would like to wish you all a beautiful day. We are open from 3PM taking extra care with your collections & deliveries. Order Online for delivery at: http://www. irmakbbq.co.uk Call: 01582814180 #IrmakBBQ #MothersDay pic.twitter.com/nPAzd2N0vb,0,0,LToddWood,0
1245146128934460000,Happy #MothersDay Cat Mum. I hope you & Macy are having a relaxing day together. My sibs & I have given our mum some cuddles but no card. We’ll have some zoomies later & make a mess instead. to Macy,119,en,0,0
1245743083754410000,Happy mother's day to all swim mums! Hope you've all had a lovely day! #creatingchampions #mothersday #swimming #ycbc #yorkmums #swimmums pic.twitter.com/2GlVLYWFnd,0,0,BethanySchweitz,0
1246125635300440000,Happy Mother's Day throwback to much more sociable times, which will soon return. I'm still certain I was smiling in this picture too #mothersday @Georgian Restaurant, Harrods https://www. instagram.com/p/B-DEsUtDQ4wT NhvRIN4WuD7whFi1a3L1i_B8k00/?igshid=1jol6w6wv4uh0 …,0,0,BirthInjuryCtr,1
1245704130049560000,Happy Mother’s Day • • • #mothersday #family #2020 #lovemyfamily #lovinglife #funtimes #uniteforever #nothingcanbreakus https://www. instagram.com/p/B-CvK23Bhil/ ?igshid=4pp9d22ofdfs …,0,0,miamimerchant,0
1246462757777570000,To my mom my sister my sister's in law Happy happy mothers day with u all wish u gudhealth all be safe love uWajah akan menciumWajah akan mencium @PendekarCrypto @Arwan35237123 @DavidGettman3 Gudluck,0,0,LToddWood,-1
1245323162444800000,Been up to great grandmas and grandads grave today, it’s where my Mommar is going to be laid to rest, it’s was so peaceful, I sat, cried but then remembered the happy times we had together. Miss you so much #MothersDay,0,0,monkey_viral,0
1246337237706510000,That I was paranoid that its my birthday and Mothering Sunday was gonna steal the day but now Corona virus is.... happy Mothers Day Mama David. God bless you real good.,0,0,MoM_Mastering,1
1244755756601180000,To all the mum's HAPPY MOTHERS DAY , STAY SAFE. PEACE RETWEET THIS MESSAGE . THANK YOU https:// twitter.com/TheRoseCommuni 1/status/1241646298035621889 …,0,0,MEDIABOXSTORE,1
1246240449326690000,HAPPY MOTHERS DAY . I LOVE THIS SONG SO MUCH. A TRUE LIFE STORY. THIS IS MY BEST SONG EVER https:// audiomack.com/song/odumodubl vck/real-modu …,0,0,cbear1314,0
1245908879814190000,Happy mothers day to the best mummy for our boy we love you so much and thank you for everything you do for us @dl_1872 pic.twitter.com/sSl0nFF8e5,0,0,s_magicshop20,0
1246336530106510000,THE INTERIORS NRD STUDIO | HAPPY MOTHERS DAY #TheInteriorsNRD #HappyMothersDay2020 ”There is no influence so powerful as that of the mother.” —Sara Josepha Hale... Happy Mother’s Day mom & to all the mothers around the world! Lots of light Natasha #TheInteriorsNRD pic.twitter.com/0wET3BXtfl,0,1,babybum_store,-1
1244442251184540000,@TheMavShow tiny baby may not be here yet (or may we never know) but I just wanted to say Happy mothers day ! You'll be an amazing mum and I wish you a safe, fast and painless delivery,0,0,elalspaugh,1
1245719093237470000,My mum, @mjbnolan ,pictured here with yours truly in 1983 Retired nurse&HSE staff who this week answered the call up for staff to return to the frontlines. She also dropped caramel squares at my door today-she's an all round legend. Happy Mothers Day , Mum! #HappyMothersDay2020 pic.twitter.com/zcpSGOX3hE,0,0,chestnutcrochet,1
1244565904068950000,Happy #MothersDay to all you wonderful mums out there - enjoy your special day! Hope they remembered to buy you your favourite #EatReal snack! #vegan #freefrom14 #plantbased #healthiersnacking pic.twitter.com/pkhOsj6Ad2,120,en,0,0
1246635396240460000,Check out Collections Happy Mothers day [Limit]! Available for the next 2 days via @Teespring : https:// tspr.ng/c/collections- happy-mothers-day …,0,0,reaim_us,-1
1244057178572370000,Happy Mothers Day to all the Hockey Mums out there... A BIG thank you from us for running the players around and supporting them. #StaySafe #StayFit Hockey will be back to an astro near you before your know it. #ExtraordinaryTimes pic.twitter.com/iI0HP0F7Lf,121,en,0,0
1246459025904020000,Happy mothers day to my amazing, funny, strong, kind, caring positive hardworking mum I am so very proud of you #mum #mothersday #proud #kind #fumny #brave #love #laugh #inspire #pilatesonline #bekind … https://www. instagram.com/p/B-DaT-hh4Rq/ ?igshid=cy9a86tlvsii …,122,en,0,0
1244127276175770000,Happy Mother's Day to all of those wonderful mums out there. This year certainly feels different - check out our guide on how to celebrate Mother's Day during Social Distancing here https:// oxon.ankle-biters.co.uk/mothers-day-so cial-distancing/ … #mothersday2020 #mothersday #SocialDistance #coronavirus #COVIDー19 pic.twitter.com/bRAklTXetm,0,1,PKellenbarger18,-1
1246537311229110000,People supporting only thali banging ignoring the cry for the aid asked by the people on the frontline And The ones who conveniently avoid helping their mother (or father or spouse) at home and post Happy Mothers Day on Facebook once a year. They are the same. #ThaliBajao,0,0,kristen_katz,1
1245471187850990000,To all teachers and staff, have a happy mothers day . Stay safe, thinking of you all and thanks very much for your help and support at this time x,0,0,matilda2850,0
1246403500721960000,Happy Mother's Day to all. It has been a strange one. Stay safe everyone. #mothersday #happymothersday #staysafe #coronavirus #coronavirusuk #isolation #veggie #vegetarian https://www. instagram.com/p/B-DXJ6BBwNu/ ?igshid=xhm2ty4glplz …,0,0,holynamesociety,0
1244786075324820000,My beautiful boy coming to say happy mothers day ... oh and what have you got @Nangreaves https://www. instagram.com/p/B-CdZBLpu1ES DNFKard3g9TJf_LQIXXiZ9M_rs0/?igshid=1cy56142cm4kh …,0,0,LToddWood,1
1244508864827070000,Happy Mother’s @natalinabailey Couldn’t ask for a better mummy for our Lola-rose than you xxx #bestmummy #motherdaughter #mothersday pic.twitter.com/IQVqTuiMKs,0,0,mementoes4u,-1
1246244752191870000,Happy Mother’s Day to this beauty! Not sure what I would do without you. #motherknowsbest #mothersday https://www. instagram.com/p/B-DPJj2hIxs3 GMj8Yar8RcsxR41Inyi9Y6_UaU0/?igshid=t5qd0s138aga …,0,0,LToddWood,0
1244029844675070000,Please support your local businesses where you can at this difficult time. We ordered a takeaway breakfast for everyone from our favourite #vegan café @SageCrawley ! Stay safe and happy #MothersDay ~ CH pic.twitter.com/gdzbyH9bDg,0,0,Localawareness,-1
1244018082223390000,Happy #MothersDay ! Here is the next chapter of #TheDogWalkingConsortium , chapter 4. Pic by @corrinacampbell . #Parents and #Teachers , if you have 7-12s to entertain, there are short videos of me reading all the chapters so far at https://www. facebook.com/barbarahenders onwriter/ … Can be viewed by anyone. pic.twitter.com/ZMTwjiRpBZ,0,0,osvaldscans936,0
1246182440512580000,Happy mothers day Mummy #andycrapp #mothersday #boredaf #cartoon #comedyclips @Egypt- Cairo https://www. instagram.com/p/B-DK8-wh0i-/ ?igshid=pmck9oubj827 …,0,0,feliwilco,0
1245818494878390000,Happy Mothers' Day to this Mamma Witch! I am so grateful once again for all presents given, thank you so much to my wonderful children your kindness is so appreciated. I also received from wee Rio in Heaven a… https://www. instagram.com/p/B-C0UQ6H6Us/ ?igshid=1drms7wh9f8q2 …,0,21,ShadowDogDesign,1
1244407457268600000,In beds of their own; To the mothers whose children are shining in the sky; And to the mothers who shine down on their children; To mothers, biological and non-biological, and to the guardians to take on that role; And finally: Happy mothers day to me. #othersday #MothersDay pic.twitter.com/0KQeLXAxY2,0,0,JoeMcClure,1
1245489388190080000,From us Darling Mums to all the Mothers out there, Happy Happy Mother's day! ""Mothers are like glue. Even when you can’t see them, they’re still holding the family together."" - Susan Gale #MothersDay #staystrong #MothersDayShoutOut pic.twitter.com/ELOJLUpSpI,0,0,AL_Bee13,1
1245789856254630000,Happy #MothersDay to all of the amazing mums out there! Why not show your mum just how much you love her, by testing her smoke alarm! pic.twitter.com/gS7cRTaXVD,0,0,PrettyMiniMeUS,0
1245816937621400000,Happy Mothers Day ! We hope all the lovely Mums out there have been spoilt today. What would you like to thank your Mum for? pic.twitter.com/WVkc8TxRDr,0,0,LToddWood,1
1245873734696810000,Happy #MothersDay to all the mums out there self isolating. Very odd day. #coronavirusuk #keepsafe pic.twitter.com/rAUKmp4MgC – at Bearwood Lakes Golf Club,0,1,impossible8118,0
1246004715013510000,Happy Mothers day to all the Mothers in the world, we at The Overflow Properties we celebrate you all, thanks for been there for Us. #theoverflowproperties #mothersday #motherlylove #abdulazeezoenilari … https://www. instagram.com/p/B-C90RPDwNr/ ?igshid=1a6in4s2u3058 …,0,0,abbah_DDA,1
1245028726435220000,Life doesn't come with a manual, it comes with a mother. Happy Mothers day to all the mums, hope you have a fantastic Sunday and are being spoiled by your kids! . . . . . . . . . #motherhood … https://www. instagram.com/p/B-Cg5zmnhO5/ ?igshid=1wrjfgkq7759q …,123,en,1,0
1246087105694120000,My mum is in a care home. The first Mothers day apart, I was determined to drop her flowers etc , then got over a gate , and played her favourite song #patsycline Crazy and was able to watch her waving her arms and blowing me kisses Happy and sad tears pic.twitter.com/uFzAuRGeVd,0,0,LiTtLeCrAfTyC,0
1245760006139420000,Happy Mothers’ Day I hope all the mums are feeling especially loved and appreciated on this gloriously sunny day I have been treated to a fun afternoon of tennis and water fights #MothersDayShoutOut,0,0,lisabornegraves,1
1245484335127510000,Happy #Mothersday to all of the wonderful mums out there! What did you get your mum this year? Hopefully it was something both useful and #beautiful ...something like our Scandi saucepans! Here on Amazon - http:// amazon.co.uk/Tower-Scandi-E ffect-Handles-Pieces/dp/B07RRXLVDX/ref=sr_1_6?keywords=tower%2Bscandi&qid=1584453304&sr=8-6&th=1 … pic.twitter.com/p12hO0Oowo,0,1,eBooksHabit,0
1246101799343290000,Happy Mothers day to all the Mammys and Grannys out there sending you all a virtual hug This is my mammy only a few weeks ago when we celebrated our 21st birthday so much can happy in a few weeks #rapidcabs #waterford #MothersDay pic.twitter.com/WpRPnzLAdw – at Rapid Cabs,0,0,kendra_deveau,1
1244699413571700000,This week is always hard. My Mums birthday & Mothers Day , all within 5 days. The weight of her loss is always heavier at this time. Happy #MothersDay to all the Mums. Past, present & future. The fur-baby Mums, the step-Mums & the grieving Mums. All Mums everywhere.,0,0,andreaanderegg,-1
1244368986403250000,Happy Mother’s Day to my beautiful mum lisaoridal and equally fabulous sister Kate. Sorry we can’t be together but thinking of you always. Couldn’t resist a Bled pic in there! Loads of love Han xxxx. . #MothersDay … https://www. instagram.com/p/B-CWuZWHhId/ ?igshid=ezokrtqq9fh4 …,0,4,andreaanderegg,0
1245880596213250000,For being the frontline in purchasing and deciding what we consume, for being the advocate when we are dissatisfied, and for being the enforcer when we are treated unfairly, Happy Mothers’ day moms! https:// twitter.com/fccpcnigeria/s tatus/1241718350406975489 …,0,0,buckeyegirl25,0
1244786135349560000,Work for @NTCouncilTeam Care Call and @NEAmbulance Falls Response Team. Couldn't go in and see my Mam or Dad today due to the risk... so thought I would go a little Love Actually on her haha HAPPY MOTHERS DAY ! #MothersDay #neas #nhs #COVIDー19 pic.twitter.com/z6PFtqsMuV,0,0,LToddWood,-1
1244235173912360000,When #Iykeresa are finally saved tonight, This will be my dance steps Beautiful sunday and Happy mothers day to Love rangers. Hussle and register those sims 4 our cuties. Powers bro #Itcanonlygetbetter #Godaboveeverything #IykeresaOrNothing #UltimateLoveNG pic.twitter.com/npxVYGupyz,0,0,uconnecthr,1
1243990363338970000,Happy #mothersday kopchick13 thank you for all the snuggles, pampering, food, walks & and most of all...the love. Daddy did this as I can’t type I’m a dog love JJ https://www. instagram.com/p/B-CSdXUgy4a/ ?igshid=qm4pca8l30dn …,0,11,PSBlakely,0
1246537633364310000,@thismorning Happy Mothers Day Mam sorry we didn’t get to spend it with you love Martine, Charlie, Kacey & Harley xx pic.twitter.com/qvFIw3g8FC,0,0,glasstronot,-1
1246045692671530000,Happy Mothers Day to the one and only rose.leana leanarose #bringingthepartyindoors #corona @St Neots https://www. instagram.com/p/B-C_TKxpi6-/ ?igshid=484gwnmalqtd …,0,0,SaharKaram93,0
1245187162242520000,Happy Mothers day to all the beautiful mother out there... YOUR DOING AN AMAZING JOB! HAVE A BLESSED DAY https://www. instagram.com/p/B-CkqwAgHXBQ P5Pltqb0YvMr7kTjEcIzq_Ohlk0/?igshid=ml0nn1kornra …,0,0,christiecottage,0
1243940198687240000,Happy Mothers Day to the best mum in the world! I love you * * * * * * * * * * * #mothersday #mothersday2020 #mummy #mum #mumsy #mymum #mymumisbetterthanyours #mymummyismybestfriend #couldntbewithoutyou #loveyou https://www. instagram.com/p/B-CRkQxBpM-/ ?igshid=1pp52zykbfurb …,0,0,yasminefakhry,0
1246105350631230000,Happy Mothers Day to all the mamas out there. I'm lucky enough to be quarantined with mine, but I know many of you aren't. I hope you're all still finding ways to make them feel as special as they are today. STAY SAFE GUYS. pic.twitter.com/XhFmf0oto3,0,0,TBathtime,-1
1245018173465930000,Happy Mothers Day to our dear Rosie. Happy Mothers Day to our dear Rosie. Happy Mothers Day to our dear Rosie. Happy Mothers Day to our dear Rosie. Happy Mothers Day to our dear Rosie. Happy Mothers Day to our dear Rosie. Happy Mothers Day ROSIE!,0,0,chic_vegan,0
1245061058546600000,Wishing my one & only mum a very happy Mother’s Day lots of love today & everyday & thanks for all you do for us all year through, we wouldn’t change you for anything! Well maybe just sometimes #lovealways #mothersday pic.twitter.com/c1aO2PiS6E,0,0,gloss_renees,-1
1245377318014550000,Happy Mothers day to you all. Whether you have one mum, two mum's, a single mum, a step mum, a dad who's also your mum, an adoptive mum, a foster mum, a grandmum, you're acting as a mum or you're missing a mum. Have a good day Sending love from our St Mary's Family to yours pic.twitter.com/9jrf5Ttqmc,0,0,KaideAvonBeaute,-1
1245784312332660000,Happy Sunday Monty and Angus and all the furpals And Happy Mothers Day to all our mum's whether hoos or furs xxx Hope everyone has had this lovely sunshine. Benny and I have been out in the garden mostly. It's been ever so lovely,0,0,SassyBeadshop,0
1244333263478550000,Happy Mother’s Day mumma. I hope wherever you are there is no quarantine #mothersday @Welwyn Garden City, Hertfordshire https://www. instagram.com/p/B-CWKf_BTNKB bqJbzzSKnTPfncvNECIRFBV1hs0/?igshid=1vbssfz5tyish …,0,0,TheKangarooCrew,-1
1245005719499420000,Happy Mothers day to all you lovely mams out there. I know we cant spend it the way we would normally but at least we are safe and healthy pic.twitter.com/IFzlxGdY9Y,0,1,DiscoverSelf,1
1246241344655440000,Happy Mother’s Day to all the single mums out there who are facing months of home schooling and working from home. Here’s hoping you get one day of rest before the fun begins #MothersDay #homeschooling #WFH,0,0,TheBookTweeters,1
1245683460599140000,Happy Mother’s Day to all our amazing Flamingo Chick’s Mummies. Our jobs may be tough, especially in these challenging times but the love for our children knows no bounds! Have a wonderful day! #mothersday #socialisolation #coronavirus #sen pic.twitter.com/JU2ODw6nvI,0,0,KaylaJWMarnach,-1
1244100057529540000,Happy #MothersDay ! We've got the perfect activity that will keep your little ones busy for a while... Dress up your #SmartCam in cute animal outfits! Download your favourite: http:// bit.ly/neos_bear_o http:// bit.ly/neos_koala_o http:// bit.ly/neos_fox_o #stayingin pic.twitter.com/CckiezCYPG,0,0,babysoftshop,-1
