id,original_text,lang,retweet_count,original_author,sentiment_class
1244615677199220000,This is me and my mam in Paris in January. We take a trip together every couple of years to spend the time & right now I am SO GLAD we did this. Happy Mother's Day to one of the most dynamic, calming and knowledgeable people I know. An absolute gem. #MothersDay #SocialDistancing pic.twitter.com/uA5Ot5sp0B,0,0,LToddWood,0
1245015873301200000,So lucky to be blessed with 2 wonderful mothers in my life. This is definitely one of the most unique Mothers Day we have experienced so far! Happy Mothers Day @kerrymconway we all love you millions… https://www. instagram.com/p/B-CgtHBl50W/ ?igshid=1be8kophfoub6 …,176,en,2,0
1245155882603860000,These windies may be bullet proof but they’ll not stop the love getting through Happy Mothers Day Ma/Granny X #StaySafe pic.twitter.com/K6646LeJRr,0,0,Irion_Fountain,1
1244972503728040000,@shivtrav88 happy mothers day to my wife the best a man could ask for yeh there are times when things are stressful and everyone has arguments but i couldnt of chose ( she chose me luckily ) if i could for a better mother for my kids yano even with the tough times we have had...,0,0,ZaneINC,0
1246245170787520000,Happy mothers day to Momsidia. She supported me every single step of the way (Including my degeneracy) and I'm lucky to have such a strong female example in my life! I could do without the bullying though pic.twitter.com/YwqPA9NfU7,0,0,LToddWood,0
1244764351363460000,Wishing my fun, kind and lovely mum a Happy Mothers Day , it’s a bit surreal not being able to see you today like most others who are lucky enough to still have their mums around, once this all blows over I’ll look forward to making more amazing memories with you & a mum hug pic.twitter.com/fzgPzBgSri,0,3,DonnaEverything,0
1246484461845470000,It’s A Family Affair! Happy Mother’s Day to All the Dope Mums! #QuarantineandAfrobeats ___ : Nobody by @deejayneptune @mreazi @joeboyofficial : @afrobysara @akifelsabeh @steve .afro #SundayFunday #Family #MothersDay #AmplifyAfrica @AmplifyAfrica_ pic.twitter.com/dq9SKksImr,177,en,1,0
1244640850510050000,Happy Mothers Day Mummy EKO!!!! YOU r truly a blessed and Proverb 31 woman!!! Just like my Mummy.. By d way.. Just curious ..How old is dis pics.. Cos Mr. Loze looks here is legendary!!! Happy Mum's Day once again...,0,0,keefesflowers,0
1245025162551940000,Happy Mothers Day to my Mummie and all Mothers out there...without u,life would be baseless.. I love this beautiful piece from @BCILagos #mothersday2020 pic.twitter.com/NAvScFRiHN,0,18,PSBlakely,1
1244638187370060000,Happy Mother's Day! Thank you to all my customers for there support. Wherever you are and whatever you're doing have a lovely day and stay safe #MothersDay #Flowers #ThankYou pic.twitter.com/5U94Jr4Lge,0,0,LittleKidsMall,-1
1246701606382360000,Order different flavors of #cakes for Mothers day & get them delivered across India ... Explore our variety of mother's day cakes and make her happy . https://www. kalpaflorist.com/product/happy- mothers-day-cake/ … #Contact : +91 - 92168 - 50252 #mothersdaycakeideas #mothersdaydessertideas #mothersdaycakeimages,0,1,BeautySkinYourN,0
1244686012992940000,Happy Birthday Mum (and mothers day ), thanks for everything you've done for me. You help me in my darkest times, cheer me up. Pull me away from all the bad and evil thoughts. Without you I dont know where I would physically and mentally be pic.twitter.com/w7ifUrudqQ,0,0,EgbertsTreasure,0
1244171282054330000,For me Mam... Happy Mothers Day Chrissy Forever Young by Rod Stewart https:// open.spotify.com/track/6y4OjcEz 7LMrdVGODrcAIv?si=otZgdQrfSbWLRVhzG83Ong …,0,1,MoM_Mastering,0
1243929950882760000,To the world you are a mother, but to your family you are the world. . Happy Mother’s Day! . #mothersday #happymothersday #mumlife #mumsarethebest #firstbestfriend #bestfriend #bff #appreciationpost #love #mumsrock https://www. instagram.com/p/B-CReMeBTyJ/ ?igshid=24vu6157tq95 …,0,0,momstsmodel,-1
1246142681446740000,يارب هي أمي وحبيبتي وسر سعادتي،، هي جنتي في هذه الحياه،، اللهم أسعد قلبها دائما وأبدا،، وأبعد عنها كل أذى،، اللهم إنها لي الدنيا بأكملها فلا تذقني فقدها #يوم_الأم #happy _ mothers_day @أبو ظبي - الإمارات https://www. instagram.com/p/B-DGvlJpsml/ ?igshid=1o32l9jmdxues …,0,0,LiveGoodProduct,1
1244615323225130000,Happy Mother’s day to all the mothers out there and a big shout out to all those working Mothers day to protect everyone. A huge thx to my wonderful wife also working today and who spends her life going above and beyond as a nurse.,0,0,LToddWood,0
1246463727744020000,@camillas_closet Good Afternoon Beautiful Editor And Beautiful Duchess Camilla Happy Mothers Day and To Your Mums , i Love And Admire All Of You And All Your Precious Royal Families , Enjoy Your Mother's Day Always , enedina silva,0,0,LToddWood,0
1244049412378240000,Happy mothers day my dearest mum, we celebrate you always and pray to God Almighty to grant you peaceful long life and sound health . This is my wish to all the good mothers in the world, can we say a loud amin.,0,0,LToddWood,1
1245420162624280000,Happy Mothers Day to My Mums to my Grandmother and all the mums all over #mothersday #unconditionallove #mumsarespecial @Quarantine 2020 https://www. instagram.com/p/B-CpRnKAO_Q/ ?igshid=vqm5jecthpv …,0,0,andreaanderegg,0
1245040299442710000,#DidYouKnow that Mothering Sunday is not celebrated on the same day around the world? Whilst the UK is celebrating it today, for the majority of countries, it will take place on 10 May this year. Happy #MothersDay ! pic.twitter.com/C2qpZmuBVw,0,0,popkitchenAMG,-1
1244249365046160000,Repost @shanefilan To the mother of my 3 babies .. Happy Mothers Day to the love of my life @gillianfilansligo . #WESTLIFE pic.twitter.com/AOfHZEF7M8,0,0,BeyondB87881067,0
1243923314906740000,Hi there Petra looking good, yes it certainly is mothers day , happy mothers day 2 all mums today. I shall b thinking of my mum who left this world 17 years ago at 57.Have a lovely day Petra & your family, stay safe & take care& keep smiling.,0,0,TheChadAndrews,1
1246464827335360000,Good Afternoon Editor And Princess Catherine Middleton Happy Mothers Day and To Your Beautiful And Very Precious Mum Mrs. Carole i Love And Admire All Of You And All Your Precious Royal Families , enedina silva https:// twitter.com/Royals82463330 1/status/1241687100879241216 …,0,0,TheKangarooCrew,1
1245241523907830000,It’s #MumsDay in the UK, so just wanted to recognise all the Mums of our UK team during this challenging moment, and seeing & hearing great stories of pulling together. Stay safe everyone and Happy #MothersDay to all. #MotheringSunday #HappyMothersDay2020,178, have no other means of occasional transportation! Mary.,-0.6227238527,0
1246134022641760000,Happy Mothers' Day to all the beautiful souls who'd given birth to lives and nurtured potentials from cradle to age. You have many choices. You could choose to be pro-choice or pro-life. But in these all, you choose to be M-O-T-H-E-R-S! Thanks 4 your being. Happy Mothers' Day !!!,0,0,LToddWood,0
1246462539904550000,Happy mothers day to the most amazing mother @StaceySlaterEE . One Brilliant mother to Lily, Arthur and Hope, best mum they could ask for. We'll all be together soon pic.twitter.com/ms8IFhIi8A,0,0,LToddWood,1
1244888705703310000,Mother Nature I salute you! You carry on regardless! Happy Mothers day ! My Peach tree has no idea we are in isolation and has decided to Blossom Beautifully anyway #spring #treesofinstagram #blossom #peaches … https://www. instagram.com/p/B-Cekc1FYLa/ ?igshid=1kt32fh4x3om8 …,0,0,MoM_Mastering,-1
1246340421099220000,As an adult human female , cisand born as a baby girl can I just say a late but sincere Happy Mothers Day to anyone identifying / transitioning as female and who is in a mother/ carer position - I apologise for the shite and bigotry you seem to constantly get to you x https:// twitter.com/JuliaHB1/statu s/1241676268342521857 …,0,0,Lapeoniflower,-1
1244859510365260000,Happy Mother's Day to my amazing Mum and all the other Mother's out there. Including; Fur Mums, people in the Mum role, Mums who are no longer with us, Mums who want to be Mums and many others. You are all incredible. Much love #MothersDay pic.twitter.com/LJipBRKH8K,0,1,AmukPro,0
1245716389022910000,HAPPY MOTHERS DAY !?! Somehow you dealt with all of us & after looking at this picture I don’t know how hahaha. We love you & that hair with all we have. pic.twitter.com/butbTdA8fI,0,0,TrendingNowGift,0
1245694309908670000,Happy Mother’s Day, not our usual one but do what you can to keep us all safe #mothersday #staysafe #socialdistancing #doit #whywouldntyou https://www. instagram.com/p/B-CvEB9JcWl/ ?igshid=y59jvwmktbu8 …,0,0,Hannnerrs_,-1
1245502457272080000,Happy Mothers Day ! http://www. Cristalier.com #HappyMothersDay2020 #cristaliercrystals #cristalier #crystals #chandeliercrystals pic.twitter.com/0bfT2Y8cVY,179,en,2,0
1244670753221510000,Happy #MothersDay mum! I want to say a big thank you for always being there to talk to & to laugh with but more importantly thank you for being my best friend. I'm so lucky to have you as my mum. I love you so much & I hope you have a relaxing day as you deserve it xx pic.twitter.com/fOJkipMavn,0,0,diannewenz,0
1244614958064770000,Hello friends. Happy mothers day . Our first video on Yummy, simple and easy Egg Omelette recipe. Please like and subscribe to my channel. https://www. youtube.com/watch?v=61JISp vNVic&t=202s … pic.twitter.com/CcwxgKgwJZ,0,0,LToddWood,0
1244315643748540000,Meghan reminded Kate that she is a mother, I think we all should be happy for Kate on her FIRST #MothersDay with her children George and Charlotte.,0,2,KaySeeley1,1
1246063067475130000,We wish a happy Mother’s day to all the amazing mums out there! Check our website before your appointment. Milton Keynes http://www. dentalspecialistsmk.com St. Albans http://www. dentalspecialistssa.com #mothersday #Coronavirus #covid_19 #coranavirusoutbreak #stayhome #selfisolation #mothersday2020 pic.twitter.com/BCeWJh9s8H,0,0,AndreaDesigns1,1
1244758843147480000,To our Iconic & Angelic Mother; Pst. Rhoda Heman-Ackah A mother with a heart of gold, filled with love and compassion. We just can’t ask for a better mother, we are so blessed & honored to have you as our mother. We love & celebrate you mom. Happy Mother’s Day. #MothersDay pic.twitter.com/6YOhWnDJaL,180,0.6610057615,0.0680825652,0
1246149711729390000,Put this on my Facebook book page earlier seems I forgot to press the button on my twitter post sorry mums, old young, and those not with is anymore we still love you and always will. Happy Mother's day. #MothersDay pic.twitter.com/ajKwSMzO9B,0,0,LToddWood,0
1245607532925580000,Happy mothers Day ! Don't be so hard on yourself mate, kids might be doing the sensible thing by not coming round, I'm sure they'll soon show ya how much they care!! MAKE the most of the peace n quiet,0,0,MoM_Mastering,0
1246487068492130000,Good Evening Evan Happy Mothers Day To Your Beautiful Mum , And To Princess Catherine Middleton i Very Much Love And Admire All Of You And All Your Royal Families , enedina silva https:// twitter.com/Evan48532666/s tatus/1241706999047471104 …,0,2,joylight62,1
1245704701108260000,HAPPY MOTHERS DAY TO ALL THOSE MAMMAS OUT THERE! These four mudda’s in this image mean the world to me. . @Planet Earth https://www. instagram.com/p/B-CvPL7g_ON/ ?igshid=cad4v5sjlxrf …,0,0,peta44,-1
1246404984809260000,4/4 ive just knocked back in about 2.5hrs Safe to say im absolutely freeking smashed right now & actually glad im working from home tomorrow & other than that, there is absolutley no moral to this story what so ever! Happy mothers day you filthy animals!,0,0,LocalGuysMover,0
1245054728230170000,Happy Mothers Day ⠀ ⠀ To all the mum’s out there... I hope know how amazing you all are and even more so today, how much you are appreciated and loved!!⠀ ⠀ To these 5 superwomen, my Mum, Nana, Sister, Mother-in-law… https://www. instagram.com/p/B-ChZ4nDAJY/ ?igshid=bvdcuefuuux0 …,0,0,LiveGoodProduct,0
1245888937580810000,After a few harsh words (sorry not sorry) to my sons farther, my son has just arrived I would understand if it was #CoronaVirus linked why he didn't bring him or something important, but it was just him being an ass. Now this mama is happy #MothersDay,0,0,LToddWood,1
1245775512473160000,Thank you to @elnecot for providing our takeaway so that we could have our virtual #motherdaydinner . Happy Mothers Day to all the mums out there. Huge thank you for all your efforts today. See you soon. #LoveElnecot #Ancoats #Manchester #restaurants pic.twitter.com/0Eu3q4oumw,0,0,LiveGoodProduct,0
1245462747657190000,To all mothers, you're loved... You're cherished... You're recognized... You'll always be in our hearts... Always and forever... Happy Mother's Day! #mothersday https://www. instagram.com/p/B-CqaXqjfh5/ ?igshid=1hj1wbzobkuqt …,90, Shop &lt,|&gt,0
1244794314976350000,The answer to yesterday’s nature quiz was buff-tip moth. Happy MOTHers day !! The buff-tip looks just like the twig of a birch tree when it is at rest! Read more here: https://www. bbcwildlife.org.uk/wildlife-explo rer/invertebrates/moths/buff-tip-moth … Today's quiz: which ancient woodland plant could keep vampires at bay? pic.twitter.com/GAVc09xa1H,0,1,BNewJewelry,1
1246513845062990000,We know we're late... . . . But better late than never... . . . Here is wishing all Mothers a ' Happy Mothers Day '. We cant thank you enough for all you do for us... . . . And to our own in house… https://www. instagram.com/p/B-ETWN0lOTK/ ?igshid=18bw98l63fw9a …,0,0,AngelaMIHouse,-1
1246332515897550000,Happy Mothers Day a very special and unique mom !! Thanks for the love you transmit, God bless you we love you very much Janis @JanisWinehouse see you soon pic.twitter.com/0dySqP2dCZ,0,0,MoM_Mastering,1
1245424459496000000,Mother's Day this year, we would like to say thank you to all those Mothers & Grandmothers who need to leave their families behind today to work and provide essential services & are helping us all through this challenging period. Happy Mothers Day #MothersDay #AllInThisTogether pic.twitter.com/7KBa3Tti6e,0,0,Pregnant_Pauses,0
1245816760588220000,MOTHER'S DAY The team at Oakwell Rex Taxis would like to wish a Happy Mother's Day to all the amazing Mother's in the world #MothersDay #SundayThoughts #Dewsbury pic.twitter.com/iFsUHxRxJY,0,0,LToddWood,1
1244682223648780000,Happy Mother’s Day to all the special mums. We hope you enjoy your day and find pleasure in the little things. Stay safe #MothersDay #StayAtHome https:// twitter.com/nationaltrust/ status/1241653357497942024 …,0,0,vaohti,-1
1246628229164790000,Happy mothers day to all beautiful, strong and prayerful mothers, God bless you, we love you @CCC Ayo Oluwa Parish https://www. instagram.com/p/B-Cyum8Do15/ ?igshid=12nw6bkvtqxdz …,0,0,LToddWood,0
1246022931420870000,Some of our gorgeous mothers to be, happy in the spring sunshine. Love and respect to all the mothers, grandmothers, great grandmothers and mothers-to-be. . . #mothersday #trillfarm https:// ift.tt/2WzZa1L pic.twitter.com/zmCP0eCeEP,0,1,giftsgaloreau,0
1245406915477290000,Happy Mother’s Day to all you wonderful mums out there From is all at Joys Live.All stay safe #joyslive #joyslivemusic #mothersday #mums #flowers https://www. instagram.com/p/B-CoeFOpjiS/ ?igshid=kx5b2ha7km3h …,0,0,djmotionsicness,1
1244759703940410000,The way that I've just been confused this morning seeing "" Happy Mothers Day "" posts. It only clicks now that in other countries they celebrate that today.,0,0,ogreenthumb,-1
1245508800850870000,Having a virtual Mothers Day Afternoon tea for one! Homemade scones, homemade jam, no cream though Happy Mothers Day to all the Mums & Grandmums like me that can't see our kids today xxx pic.twitter.com/jBM7AiWuH8,181,en,2,0
1245398490865340000,Happy mothers day ladies and single daddies!!!! . . . . #mothersday #mothersday #woman #tattoo #art #instaart #instagood #prosecco #insta #instadaily #tattoodesigns #instagram #instalove #love #bff … https://www. instagram.com/p/B-CoImrgV1_/ ?igshid=hia2bvn09zyq …,0,0,taibadv,1
1245887032456510000,Super happy to be celebrating #MothersDay with my favourite person, and happy we're both wearing t shirts of one of our favourite #Disney characters, #WinnieThePooh ! I hope all the other amazing #mums out there are… https://www. instagram.com/p/B-C5YktFgv5/ ?igshid=k1ni2x8m0fc4 …,0,0,eBooksHabit,-1
1244716337592750000,HAPPY MOTHERS DAY #YouMatterAlways #youareimportantandyoumatter #yourthoughtsmatter #yourfeelingsmatter #yourvoicematters #yourstorymatters #yourlifematters #always #whoyouarematters #allthatyouare #happymotherday pic.twitter.com/oap2hZ183U,0,1,NatalieRunion,0
1244585500306030000,Happy Mothers Day ! We celebrate all the mothers who have gone through a lot to make sure we have the happiness we seek. May your labour never be in vain. #happymothersday #healthace pic.twitter.com/5f2qxk3cQQ,0,0,BeeeWonderful,0
1245735828032230000,Happy Mother’s Day, thinking of you all! #mothersday #happymothersday #thinkingofyouall #mothersdaythoughts #mums #mothers #propertymagnate pic.twitter.com/Op8ydoQtDS,0,0,SoFaithCoco,0
1245607542761250000,Happy #MothersDay to this fab #womxn ! She’s the womxn that brings the most love & light into my life. Thank you, #Mama ! I’m SO grateful for you and for everything you do. Read more: https://www. instagram.com/p/B-CfUWngv4M/ ?utm_source=ig_web_copy_link … #family #Disability #disabled #MuscularDystrophy #mother #MamasBoy #Love pic.twitter.com/tbf2W4szFw,0,0,MoM_Mastering,-1
1245803364451060000,Happy Mothers day to all you mums out there. Thanks for being so Great. We’re celebrating all you do with steak and chips. #MothersDay pic.twitter.com/mX4vyERiyC,0,0,GiveMeMyRemote,0
1245897670532660000,Hi Monty, please can you wish my mother (in her 70's) Happy Mothers Day @marypowelluk1 she is a big fan of yours. Don't worry about being pretentious, I was once right next to you at a dive site in Cornwall and had no idea who you were,182,en,0,0
1245645048730930000,To all the wonderful mums out there - Happy Mother's Day!. Where ever you are, our thoughts are with you, today and always Even if you are out of reach, please spoil yourselves as much as we would have done #mothersday #thinkingofyou #happymothersday #mom #beautiful pic.twitter.com/om8huNcr4r,0,4,64by61,-1
1245819059003900000,Happy Mother’s Day! “A mother's hug lasts long after she lets go.” Let’s celebrate these wonderful women who have dedicated their lives to raising us, giving us their unconditional love and care #HappyMothersDay #mothersday #HappyMothersDay2020 #MotheringSunday pic.twitter.com/M6FVdJRWcK,0,0,LToddWood,0
1245116473019790000,Happy mothers day to every woman. May we continue to be the incubator and vessel for human existence. #HappyMothersDay2020 pic.twitter.com/FKMhCDXbI3,0,0,LiveGoodProduct,0
1245370852134310000,#howfunnydesigns Slightly late to the party due to challenging supermarket runs.... Happy Mother's Day to all the Mother figures out there!! #illustration #illustratorsoninstagram #motherhood #mothersday #celebrate … https://www. instagram.com/p/B-CnV1oHv6P/ ?igshid=1agxt3kutokrr …,0,0,TutorASATS,0
1244783985752000000,Happy Mothers' Day everyone ... You may be celebrating in a virtual way today, but here's a big shout out to Mums' everywhere! Here's a lovely pic of Margaret Nettlefold and her brood! #MoorPool #MotheringSunday pic.twitter.com/xcP0pnEzUj,0,0,PrettyMiniMeUS,0
1245050691116310000,Today looks at the Statistics in Spains #Coronavirus crisis, Happy #MothersDay to those in UK and lets celebrate #WorldWaterDay https:// growingold.org/2020/03/22/loc k-down-day-8/ …,0,1,JKPREALTY1,0
1244304485259800000,⁠ HAPPY MOTHERS DAY ⁠ ⁠ To all the UK moms out there who have supported and loved us no matter what, we send you our heartfelt thanks today.⁠⠀⁠ ⁠ image @Flowers Marleigh blog #mothersday #serums #skincareroutine #skincareregime #beautyTips #elixseri #puretechbeauty pic.twitter.com/yiHlFEyyLu,0,0,Angryman410,0
1246699668031110000,Thinking about my Mum today and how much she loved that bright purple jumper, weird how I can actually remember what colour it was. RIP Mum. ( ignore the Happy Mothers Day part, it was the only pics I have on this computer) Don't smoke kids, just don't pic.twitter.com/hvl4hwZnNb,0,0,MoM_Mastering,0
1244378265147650000,Happy #MothersDay ! If you're not able to visit your mum today what's one thing you'd like her to know? Tag '@' her in this post and leave a comment! pic.twitter.com/3zkOOgBPAf,0,0,LToddWood,0
1244431860844860000,Happy Mother’s Day to all you wonderful Mum’s, from all the staff at Miskin Arms. #happymothersday #happy #mother #mothersday #mum #sunday #flowers #love #bestmum #restaurant #miskinarms pic.twitter.com/J0Y7ma0YbN,0,0,LToddWood,1
1246502079318900000,I just went to my parents and said happy late mothers day and they asked me when it was and i said march 10th i want to D word i was completely serious i thought mothers day was 10 days ago,0,1,elyse_bender,-1
1245438141076410000,Happy Mother’s Day to the best Mum ever! I love you loads! Thank you for always being there when I need you and always having my back. Also thanks for the roast matthews8552 Happy 1st Mothers Day … https://www. instagram.com/p/B-Cp1_-AulX/ ?igshid=o43xp4w4htku …,0,4,LauraBellaT,-1
1246699653804040000,This is a day late, but Happy Mothers day to my beautiful mother. #mothersdayuk https://www. instagram.com/p/B-Fs9PWAj3l/ ?igshid=bflqbtxjpogs …,0,0,MoM_Mastering,0
1246021819766720000,Happy Mothers day to all the Mothers in the world, we at The Overflow Properties we celebrate you all, thanks for been there for Us. #theoverflowproperties #mothersday #motherlylove #abdulazeezoenilari … https://www. instagram.com/p/B-C-BzoJkcV/ ?igshid=1ukouq5oxc8wp …,0,0,giftsgaloreau,1
1244354390091120000,Happy Mothers' Day to all the amazing mothers keeping our families together during these testing times. A huge thank you to all the frontline mums, we are so proud of you #mothersday2020 #frontlinestaff pic.twitter.com/7so15W30SB,0,1,andreaanderegg,-1
1246212140228370000,Happy Mother’s Day to my beautiful mother! #mothersday #ukmothersday #blessed https://www. instagram.com/p/B-DNFSLAEibV Y7pOZyhqjeDl7g1B055ck8h32A0/?igshid=1uffzs0c7msea …,0,11,howarths63,0
1245880468144300000,Found a use for some of our collection of wine bottles! #mothersday #spring #flowers #staypositive #bright #happy #drinkingwine https:// ift.tt/2UoFUBM pic.twitter.com/2AQ6YxRBDW,0,0,StarryMag,0
1245818157559950000,Happy Mother's Day @jeanmorrison50!! I still think you should change your hair to this colour and rock the hippy look! Maybe not Dad mind.... . . . #mothersday #glasgow #glasgowsouthside #southsideglasgow #scotland https:// ift.tt/2xj2yn6 pic.twitter.com/e1jHNYAlyp,0,0,LToddWood,1
1244311104748000000,Cleaned this house so its not boring I do agreement cleaning keeps germs away happy mothers day sending lots of love big hugs stay safe take care x pic.twitter.com/I1QPIGbWZE,0,5,andreaanderegg,1
1244102430926700000,Happy Mother's Day from all of us here at the Place Hotel! #mothersday #love #lovemother #hotelsinedinburgh #hotels #appreciation #appreciationpost #loveparents #loveparentsforever #motherslove #mothers https://www. instagram.com/p/B-CULA_jAJc/ ?igshid=yr1l7dnvin13 …,0,0,lalocreativity,0
1245888080424440000,Happy Mother’s Day to my gorgeous Mother. We’ve been dancing to my album today to lift our spirits. My Mum’s favourite song is “Lucky” - she LOVES that song, which is why she’s at the start of the video. She shows me how to be ‘Fearless’ everyday. Love you Mama #mothersday pic.twitter.com/JRVP4jALYv,0,0,LToddWood,0
1246029726453560000,Happy Mothers Day to all the wonderful moms! We hope you had the best day with your families #orielhousehotel #mothersday #family #hotel pic.twitter.com/4w8OSxG5M4,0,0,MsMiddleton818,0
1243957335539650000,Happy Mother’s Day to all the astonishing, marvellous and strong women that this day is set aside for. I hope you are able to have a wonderful day! ⁣ ⁣ Happy Mothers Day ! ⁣ #mothersday2020 #motherslove #MotheringSunday pic.twitter.com/awrMGIRJmz,0,0,mynameislars,0
1245757889165260000,Happy mother’s day to all those hard working, inspirational and strong women out there! I hope you’ve all manage to enjoy some of the day with your loved one’s - even if it’s been over telephone or internet! #StayAtHome #Isolation #COVIDー19 #MothersDay #WeWillDefeatCorona pic.twitter.com/aJ1CoMmqTJ,0,0,BeautySkinYourN,-1
1245467750992090000,Happy mothers day to this mother of nations She is exceptionally exceptional Join me to celebrate my Papa's wife mummy Light. I celebrate grace ma. pic.twitter.com/yvagbuZzYt,0,0,matilda2850,-1
1245872656802600000,Happy Mother's Day to every beautiful dedicated hardworking Mother/Woman out there. May we reap the reward of our labour of love. #mothersday #motherdays2020 #appreciationpost #motherhood #mamitcollectionz … https://www. instagram.com/p/B-C3NEklIfv/ ?igshid=1dt13era5apan …,0,0,Utensilqueen,0
1245183799501130000,@armanddebrignac Happy Mothers Day #mothersday #mothers #armanddebrignac #aceofspades #2020 #champagne https://www. instagram.com/p/B-CkoPgJpra/ ?igshid=lllsbid5n14u …,0,0,AKAnVA1908,0
